,authors,title,journal,publisher,volume,year,pages,full_ref,source_file,source_title
0,"J. Fiss, A. Agarwala, and B. Curless. Candid portrait selection from video. ACM Transactions on Graphics",30(6):128:1–128:8,,,,2011,,"J. Fiss, A. Agarwala, and B. Curless. Candid portrait selection from video. ACM Transactions on Graphics, 30(6):128:1–128:8, 2011",./refs/download/A compact embedding for facial expression similarity.pdf,
0,"W. Ge, W. Huang, D. Dong",and M. R. Scott. Deep metric learning with hierarchical triplet loss. In ECCV,,,,2018,,"W. Ge, W. Huang, D. Dong, and M. R. Scott. Deep metric learning with hierarchical triplet loss. In ECCV, 2018",./refs/download/A compact embedding for facial expression similarity.pdf,
0,,,,,,,,"X. Glorot and Y. Bengio. Understanding the difficulty of training deep feedforward neural networks. In AISTATS, 2010",./refs/download/A compact embedding for facial expression similarity.pdf,
0,"T. Ionescu, M. Popescu, C. Grozea, J. Bergstra, J. Xie, L. Romaszko, B. Xu, Z. Chuang, and Y. Bengio. Challenges in representation learning: A report on three machine learning contests. Neural Networks",64:59–63,,,,2015,,"I. J. Goodfellow, D. Erhan, P. L. Carrier, A. C. Courville, M. Mirza, B. Hamner, W. Cukierski, Y. Tang, D. Thaler, D. Lee, Y. Zhou, C. Ramaiah, F. Feng, R. Li, X. Wang, D. Athanasakis, J. Shawe-Taylor, M. Milakov, J. Park, R. T. Ionescu, M. Popescu, C. Grozea, J. Bergstra, J. Xie, L. Romaszko, B. Xu, Z. Chuang, and Y. Bengio. Challenges in representation learning: A report on three machine learning contests. Neural Networks, 64:59–63, 2015",./refs/download/A compact embedding for facial expression similarity.pdf,
0,"F. Cohn, T. Kanade, and S. Baker. Multi-PIE. Image and Vision Computing",28(5):807–813,,,,2010,,"R. Gross, I. A. Matthews, J. F. Cohn, T. Kanade, and S. Baker. Multi-PIE. Image and Vision Computing, 28(5):807–813, 2010",./refs/download/A compact embedding for facial expression similarity.pdf,
0,"G. Zhao, X. Huang, M. Taini, S. Z. Li",and M. Pietikäinen. Facial expression recognition from near-infrared videos. Image and Vision Computing,29(9):607–619,,,2011,,"G. Zhao, X. Huang, M. Taini, S. Z. Li, and M. Pietikäinen. Facial expression recognition from near-infrared videos. Image and Vision Computing, 29(9):607–619, 2011",./refs/download/A compact embedding for facial expression similarity.pdf,
0,"B. Zhuang, G. Lin, C. Shen",and I. D. Reid. Fast training of triplet-based deep binary embedding networks. In CVPR,,,,2016,,"B. Zhuang, G. Lin, C. Shen, and I. D. Reid. Fast training of triplet-based deep binary embedding networks. In CVPR, 2016",./refs/download/A compact embedding for facial expression similarity.pdf,
0,,,,,,,,in 1998,./refs/download/Fashion-mnist: a novel image dataset for benchmarking machine learning algorithms.pdf,
0,making it immediately compatible with any machine learning package capable of working with the original MNIST dataset.  References D. Ciregan,U. Meier,and J. Schmidhuber. Multi-column deep neural networks for image classification. In Computer Vision and Pattern Recognition (CVPR),,,2012,," PassiveAggressiveClassifier  C=1 C=100 C=10  Perceptron  penalty=l1 penalty=l2 penalty=elasticnet  RandomForestClassifier  n_estimators=100 criterion=entropy max_depth=100 n_estimators=100 criterion=gini max_depth=100 n_estimators=50 criterion=entropy max_depth=100 n_estimators=100 criterion=entropy max_depth=50 n_estimators=50 criterion=entropy max_depth=50 n_estimators=100 criterion=gini max_depth=50 n_estimators=50 criterion=gini max_depth=50 n_estimators=50 criterion=gini max_depth=100 n_estimators=10 criterion=entropy max_depth=50 n_estimators=10 criterion=entropy max_depth=100 n_estimators=10 criterion=gini max_depth=50 n_estimators=10 criterion=gini max_depth=100 n_estimators=50 criterion=entropy max_depth=10 n_estimators=100 criterion=entropy max_depth=10 n_estimators=100 criterion=gini max_depth=10 n_estimators=50 criterion=gini max_depth=10 n_estimators=10 criterion=entropy max_depth=10 n_estimators=10 criterion=gini max_depth=10  SGDClassifier  loss=hinge penalty=l2 loss=perceptron penalty=l1 loss=modified_huber penalty=l1 loss=modified_huber penalty=l2 loss=log penalty=elasticnet loss=hinge penalty=elasticnet  Fashion  MNIST  0.751 0.749 0.748 0.736 0.516 0.496 0.492 0.484  0.783 0.816 0.829 0.829 0.759 0.753 0.746 0.737  0.842 0.841 0.839 0.839 0.836  0.917 0.917 0.916 0.909 0.916  0.871 0.870 0.868 0.863 0.850 0.848 0.841 0.840  0.972 0.972 0.962 0.957 0.936 0.933 0.921 0.921  0.776 0.775 0.773  0.877 0.875 0.880  0.782 0.754 0.726  0.887 0.845 0.845  0.873 0.872 0.872 0.872 0.871 0.871 0.870 0.869 0.853 0.852 0.848 0.847 0.838 0.838 0.835 0.834 0.828 0.825  0.970 0.970 0.968 0.969 0.967 0.971 0.968 0.967 0.949 0.949 0.948 0.948 0.947 0.950 0.949 0.945 0.933 0.930  0.819 0.818 0.817 0.816 0.816 0.816  0.914 0.912 0.910 0.913 0.912 0.913  Continued on next page 5  Table 3 – continued from previous page Test Accuracy Classifier  Parameter loss=squared_hinge penalty=elasticnet loss=hinge penalty=l1 loss=log penalty=l1 loss=perceptron penalty=l2 loss=perceptron penalty=elasticnet loss=squared_hinge penalty=l2 loss=modified_huber penalty=elasticnet loss=log penalty=l2 loss=squared_hinge penalty=l1  SVC  C=10 kernel=rbf C=10 kernel=poly C=100 kernel=poly C=100 kernel=rbf C=1 kernel=rbf C=1 kernel=poly C=1 kernel=linear C=10 kernel=linear C=100 kernel=linear C=1 kernel=sigmoid C=10 kernel=sigmoid C=100 kernel=sigmoid  Fashion  MNIST  0.815 0.815 0.815 0.814 0.814 0.814 0.813 0.813 0.813  0.914 0.911 0.910 0.913 0.912 0.912 0.914 0.913 0.911  0.897 0.891 0.890 0.890 0.879 0.873 0.839 0.829 0.827 0.678 0.671 0.664  0.973 0.976 0.978 0.972 0.966 0.957 0.929 0.927 0.926 0.898 0.873 0.868  4 Conclusions This paper introduced Fashion-MNIST, a fashion product images dataset intended to be a dropin replacement of MNIST and whilst providing a more challenging alternative for benchmarking machine learning algorithm. The images in Fashion-MNIST are converted to a format that matches that of the MNIST dataset, making it immediately compatible with any machine learning package capable of working with the original MNIST dataset.  References D. Ciregan, U. Meier, and J. Schmidhuber. Multi-column deep neural networks for image classification. In Computer Vision and Pattern Recognition (CVPR), 2012",./refs/download/Fashion-mnist: a novel image dataset for benchmarking machine learning algorithms.pdf,
0,,,,,,,,"is a large scale image ontology database. The investigators of this project, namely Pr. Li Fei-Fei and her colleagues at Princeton University, have started their efforts in 2009",./refs/download/Imagenet: A large-scale hierarchical image database.pdf,
0,,,,,,,,"ontology. It is a “large lexical database of English. Nouns, verbs, adjectives and adverbs are grouped into sets of cognitive synonyms (synsets), each expressing a distinct concept”. Hence, ImageNet can be viewed as a tree where each node corresponds to a synset. Each node contains 500 to 1000",./refs/download/Imagenet: A large-scale hierarchical image database.pdf,
0,,,,,,,,"based features or object attributes, but only for images of small subsets of the 21,841 synsets (1000",./refs/download/Imagenet: A large-scale hierarchical image database.pdf,
0,,,,,,,,"J. Deng, W. Dong, R. Socher, L.-J. Li, K. Li, and L. Fei-Fei, “ImageNet: A Large-Scale Hierarchical Image Database,” in CVPR09, 2009",./refs/download/Imagenet: A large-scale hierarchical image database.pdf,
0,C. Fellbaum,WordNet: An Electronic Lexical Database. Bradford Books,,,,1998,,"C. Fellbaum, WordNet: An Electronic Lexical Database. Bradford Books, 1998",./refs/download/Imagenet: A large-scale hierarchical image database.pdf,
0,vol. 60,no. 2,pp. 91–110,,,2004,,"D. G. Lowe, “Distinctive image features from scale-invariant keypoints,” International Journal of Computer Vision, vol. 60, no. 2, pp. 91–110, 2004",./refs/download/Imagenet: A large-scale hierarchical image database.pdf,
0,NY,USA: John Wiley & Sons,Inc.,,,2002,,"P. Salembier and T. Sikora, Introduction to MPEG-7: Multimedia Content Description Interface, B. Manjunath, Ed. New York, NY, USA: John Wiley & Sons, Inc., 2002",./refs/download/Imagenet: A large-scale hierarchical image database.pdf,
0,,,,,,,,"T. Sikora, “The mpeg-7 visual standard for content description-an overview,” IEEE Transactions on Circuits and Systems for Video Technology, vol. 11, no. 6, pp. 696–702, Jun 2001",./refs/download/Imagenet: A large-scale hierarchical image database.pdf,
0,,,,,,,,"B. S. Manjunath, J. R. Ohm, V. V. Vasudevan, and A. Yamada, “Color and texture descriptors,” IEEE Transactions on Circuits and Systems for Video Technology, vol. 11, no. 6, pp. 703–715, Jun 2001",./refs/download/Imagenet: A large-scale hierarchical image database.pdf,
0,,,,,,,,"M. Bober, “Mpeg-7 visual shape descriptors,” IEEE Transactions on Circuits and Systems for Video Technology, vol. 11, no. 6, pp. 716–719, Jun 2001",./refs/download/Imagenet: A large-scale hierarchical image database.pdf,
0,,,,,,,,"S. Jeannin and A. Divakaran, “Mpeg-7 visual motion descriptors,” IEEE Transactions on Circuits and Systems for Video Technology, vol. 11, no. 6, pp. 720–724, Jun 2001",./refs/download/Imagenet: A large-scale hierarchical image database.pdf,
0,vol. 24,no. 1,pp. 23–30,,,2002,,"C. S. Won, D. K. Park, and Y. S. Jeon, “Efficient use of mpeg-7 edge histogram descriptor,” ETRI Journal, vol. 24, no. 1, pp. 23–30, 2002",./refs/download/Imagenet: A large-scale hierarchical image database.pdf,
0,” Moving Picture Experts Group,Tech. Rep.,,,,2000,,"MPEG, “Iso/iec/jtc1/sc29/wg11 - core experiment results for edge histogram descriptor (ct4)), mpeg document m6174,” Moving Picture Experts Group, Tech. Rep., 2000",./refs/download/Imagenet: A large-scale hierarchical image database.pdf,
0,,,,,,,,0.1007  0.4 0.3  64 bits 0.6835 0.5732 0.5645 0.5538 0.5852 0.3943 0.5764 0.5520 0.3578 0.4191 0.3596  NUS-WIDE 32 bits 48 bits 0.6988 0.7114 0.6637 0.6692 0.6158 0.6345 0.5827 0.5926 0.5545 0.5786 0.3327 0.3124 0.4052 0.3732 0.5425 0.5580 0.5290 0.5475 0.4209 0.4211 0.4227 0.4333  16 bits 0.6623 0.6374 0.5976 0.5696 0.4756 0.3561 0.4598 0.5086 0.5027 0.4058 0.3283  64 bits 0.7163 0.6714 0.6388 0.5996 0.5812 0.3368 0.3467 0.5611 0.5546 0.4104 0.5009  16 bits 0.6873 0.6774 0.5932 0.5642 0.5545 0.5212 0.5659 0.5818 0.5920 0.4951 0.4592  MS COCO 32 bits 48 bits 0.7184 0.7301 0.7013 0.6948 0.6034 0.6045 0.5744 0.5711 0.5642 0.5723 0.5343 0.5343 0.5624 0.5297 0.6243 0.6460 0.6224 0.6300 0.5071 0.5099 0.4856 0.5440  64 bits 0.7362 0.6944 0.6099 0.5671 0.5799 0.5361 0.5019 0.6574 0.6336 0.5101 0.5849  0.7  HashNet DHN DNNH CNNH ITQ-CCA KSH ITQ SH  0.6  Precision  Method  0.4 0.3  0.5  0.4 0.2  0.2  0.1  0.1  0  0 20  25  30  35  40  45  50  55  0  60  0.3 0.1  0.2  0.3  0.4  Number of bits  0.5  0.6  0.7  0.8  0.9  100  1  200  (a) Precision within Hamming radius 2  300  400  500  600  700  800  900 1000,./refs/download/Hashnet: Deep learning to hash by continuation.pdf,
0,E. L. Allgower and K. Georg. Numerical continuation methods: an introduction,volume 13. Springer Science & Business Media,,,,2012,,"E. L. Allgower and K. Georg. Numerical continuation methods: an introduction, volume 13. Springer Science & Business Media, 2012",./refs/download/Hashnet: Deep learning to hash by continuation.pdf,
0,,,,,,,,"Y. Bengio, A. Courville, and P. Vincent. Representation learning: A review and new perspectives. IEEE Transactions on Pattern Analysis and Machine Intelligence (TPAMI), 35(8):1798–1828, Aug 2013",./refs/download/Hashnet: Deep learning to hash by continuation.pdf,
0,"T. Hoffman, editors",NIPS,pages 153–160. MIT Press,,,2007,,"Y. Bengio, P. Lamblin, D. Popovici, and H. Larochelle. Greedy layer-wise training of deep networks. In B. Schölkopf, J. C. Platt, and T. Hoffman, editors, NIPS, pages 153–160. MIT Press, 2007",./refs/download/Hashnet: Deep learning to hash by continuation.pdf,
0,"T.-S. Chua, J. Tang, R. Hong, H. Li, Z. Luo",and Y.-T. Zheng. Nus-wide: A real-world web image database from national university of singapore. In ICMR. ACM,,,,2009,,"T.-S. Chua, J. Tang, R. Hong, H. Li, Z. Luo, and Y.-T. Zheng. Nus-wide: A real-world web image database from national university of singapore. In ICMR. ACM, 2009",./refs/download/Hashnet: Deep learning to hash by continuation.pdf,
0,,,,,,,,"M. Courbariaux and Y. Bengio. Binarynet: Training deep neural networks with weights and activations constrained to +1 or -1. In NIPS, 2016",./refs/download/Hashnet: Deep learning to hash by continuation.pdf,
0,"H. Lai, Y. Pan, Y. Liu",and S. Yan. Simultaneous feature learning and hash coding with deep neural networks. In CVPR. IEEE,,,,2015,,"H. Lai, Y. Pan, Y. Liu, and S. Yan. Simultaneous feature learning and hash coding with deep neural networks. In CVPR. IEEE, 2015",./refs/download/Hashnet: Deep learning to hash by continuation.pdf,
0,approximations,and upper bounds. Journal of Machine Learning Research (JMLR),11(Dec):3313–3332,,,2010,,"J. P. Dmochowski, P. Sajda, and L. C. Parra. Maximum likelihood in cost-sensitive learning: Model specification, approximations, and upper bounds. Journal of Machine Learning Research (JMLR), 11(Dec):3313–3332, 2010",./refs/download/Hashnet: Deep learning to hash by continuation.pdf,
0,,,,,,,,"M. S. Lew, N. Sebe, C. Djeraba, and R. Jain. Contentbased multimedia information retrieval: State of the art and challenges. ACM Transactions on Multimedia Computing, Communications, and Applications (TOMM), 2(1):1–19, Feb. 2006",./refs/download/Hashnet: Deep learning to hash by continuation.pdf,
0,"J. Donahue, Y. Jia, O. Vinyals, J. Hoffman, N. Zhang, E. Tzeng",and T. Darrell. Decaf: A deep convolutional activation feature for generic visual recognition. In ICML,,,,2014,,"J. Donahue, Y. Jia, O. Vinyals, J. Hoffman, N. Zhang, E. Tzeng, and T. Darrell. Decaf: A deep convolutional activation feature for generic visual recognition. In ICML, 2014",./refs/download/Hashnet: Deep learning to hash by continuation.pdf,
0,"W.-J. Li, S. Wang",and W.-C. Kang. Feature learning based deep supervised hashing with pairwise labels. In IJCAI,,,,2016,,"W.-J. Li, S. Wang, and W.-C. Kang. Feature learning based deep supervised hashing with pairwise labels. In IJCAI, 2016",./refs/download/Hashnet: Deep learning to hash by continuation.pdf,
0,,,,,,,,"V. Erin Liong, J. Lu, G. Wang, P. Moulin, and J. Zhou. Deep hashing for compact binary codes learning. In CVPR, pages 2475",./refs/download/Hashnet: Deep learning to hash by continuation.pdf,
0,"T.-Y. Lin, M. Maire, S. Belongie, J. Hays, P. Perona, D. Ramanan, P. Dollár",and C. L. Zitnick. Microsoft coco: Common objects in context. In ECCV,pages 740–755. Springer,,,2014,,"T.-Y. Lin, M. Maire, S. Belongie, J. Hays, P. Perona, D. Ramanan, P. Dollár, and C. L. Zitnick. Microsoft coco: Common objects in context. In ECCV, pages 740–755. Springer, 2014",./refs/download/Hashnet: Deep learning to hash by continuation.pdf,
0,D. J. Fleet,A. Punjani,and M. Norouzi. Fast search in hamming space with multi-index hashing. In CVPR. IEEE,,,2012,,"D. J. Fleet, A. Punjani, and M. Norouzi. Fast search in hamming space with multi-index hashing. In CVPR. IEEE, 2012",./refs/download/Hashnet: Deep learning to hash by continuation.pdf,
0,,,,,,,,"H. Liu, R. Wang, S. Shan, and X. Chen. Deep supervised hashing for fast image retrieval. In CVPR, pages 2064",./refs/download/Hashnet: Deep learning to hash by continuation.pdf,
0,"A. Gionis, P. Indyk, R. Motwani, et al. Similarity search in high dimensions via hashing. In VLDB",volume 99,pages 518–529. ACM,,,1999,,"A. Gionis, P. Indyk, R. Motwani, et al. Similarity search in high dimensions via hashing. In VLDB, volume 99, pages 518–529. ACM, 1999",./refs/download/Hashnet: Deep learning to hash by continuation.pdf,
0,"Y. Gong, S. Kumar, H. Rowley, S. Lazebnik, et al. Learning binary codes for high-dimensional data using bilinear projections. In CVPR",pages 484–491. IEEE,,,,2013,,"Y. Gong, S. Kumar, H. Rowley, S. Lazebnik, et al. Learning binary codes for high-dimensional data using bilinear projections. In CVPR, pages 484–491. IEEE, 2013",./refs/download/Hashnet: Deep learning to hash by continuation.pdf,
0,Y. Gong and S. Lazebnik. Iterative quantization: A procrustean approach to learning binary codes. In CVPR,pages 817–824,,,,2011,,"Y. Gong and S. Lazebnik. Iterative quantization: A procrustean approach to learning binary codes. In CVPR, pages 817–824, 2011",./refs/download/Hashnet: Deep learning to hash by continuation.pdf,
0,"K. He, X. Zhang, S. Ren",and J. Sun. Deep residual learning for image recognition. CVPR,,,,2016,,"K. He, X. Zhang, S. Ren, and J. Sun. Deep residual learning for image recognition. CVPR, 2016",./refs/download/Hashnet: Deep learning to hash by continuation.pdf,
0,"E. Hinton, S. Osindero, and Y.-W. Teh. A fast learning algorithm for deep belief nets. Neural Computation",18(7):1527–1554,,,,2006,,"G. E. Hinton, S. Osindero, and Y.-W. Teh. A fast learning algorithm for deep belief nets. Neural Computation, 18(7):1527–1554, 2006",./refs/download/Hashnet: Deep learning to hash by continuation.pdf,
0,,,,,,,,"S. Ioffe and C. Szegedy. Batch normalization: Accelerating deep network training by reducing internal covariate shift. In ICML, 2015",./refs/download/Hashnet: Deep learning to hash by continuation.pdf,
0,,,,,,,,"H. Jegou, M. Douze, and C. Schmid. Product quantization for nearest neighbor search. IEEE Transactions on Pattern Analysis and Machine Intelligence (TPAMI), 33(1):117–128, Jan 2011",./refs/download/Hashnet: Deep learning to hash by continuation.pdf,
0,"Y. Jia, E. Shelhamer, J. Donahue, S. Karayev, J. Long, R. Girshick, S. Guadarrama",and T. Darrell. Caffe: Convolutional architecture for fast feature embedding. In ACM Multimedia Conference. ACM,,,,2014,,"Y. Jia, E. Shelhamer, J. Donahue, S. Karayev, J. Long, R. Girshick, S. Guadarrama, and T. Darrell. Caffe: Convolutional architecture for fast feature embedding. In ACM Multimedia Conference. ACM, 2014",./refs/download/Hashnet: Deep learning to hash by continuation.pdf,
0,"W. Liu, J. Wang, R. Ji, Y.-G. Jiang",and S.-F. Chang. Supervised hashing with kernels. In CVPR. IEEE,,,,2012,,"W. Liu, J. Wang, R. Ji, Y.-G. Jiang, and S.-F. Chang. Supervised hashing with kernels. In CVPR. IEEE, 2012",./refs/download/Hashnet: Deep learning to hash by continuation.pdf,
0,"W. Liu, J. Wang, S. Kumar",and S.-F. Chang. Hashing with graphs. In ICML. ACM,,,,2011,,"W. Liu, J. Wang, S. Kumar, and S.-F. Chang. Hashing with graphs. In ICML. ACM, 2011",./refs/download/Hashnet: Deep learning to hash by continuation.pdf,
0,,,,,,,,"X. Liu, J. He, B. Lang, and S.-F. Chang. Hash bit selection: a unified solution for selection problems in hashing. In CVPR, pages 1570",./refs/download/Hashnet: Deep learning to hash by continuation.pdf,
0,"W. Tsang, F. Peng, and C. Liu. Partial hash update via hamming subspace learning. IEEE Transactions on Image Processing (TIP)",26(4):1939–1951,,,,2017,,"C. Ma, I. W. Tsang, F. Peng, and C. Liu. Partial hash update via hamming subspace learning. IEEE Transactions on Image Processing (TIP), 26(4):1939–1951, 2017",./refs/download/Hashnet: Deep learning to hash by continuation.pdf,
0,"T. Joachims, editors",ICML,pages 807–814. Omnipress,,,2010,,"V. Nair and G. E. Hinton. Rectified linear units improve restricted boltzmann machines. In J. Fürnkranz and T. Joachims, editors, ICML, pages 807–814. Omnipress, 2010",./refs/download/Hashnet: Deep learning to hash by continuation.pdf,
0,M. Norouzi and D. M. Blei. Minimal loss hashing for compact binary codes. In ICML,pages 353–360. ACM,,,,2011,,"M. Norouzi and D. M. Blei. Minimal loss hashing for compact binary codes. In ICML, pages 353–360. ACM, 2011",./refs/download/Hashnet: Deep learning to hash by continuation.pdf,
0,,,,,,,,"M. Norouzi, D. M. Blei, and R. R. Salakhutdinov. Hamming distance metric learning. In NIPS, pages 1061",./refs/download/Hashnet: Deep learning to hash by continuation.pdf,
0,"A. Krizhevsky, I. Sutskever",and G. E. Hinton. Imagenet classification with deep convolutional neural networks. In NIPS,,,,2012,,"A. Krizhevsky, I. Sutskever, and G. E. Hinton. Imagenet classification with deep convolutional neural networks. In NIPS, 2012",./refs/download/Hashnet: Deep learning to hash by continuation.pdf,
0,"O. Russakovsky, J. Deng, H. Su, J. Krause, S. Satheesh, S. Ma, Z. Huang, A. Karpathy, A. Khosla, M. Bernstein, A. C. Berg",and L. Fei-Fei. ImageNet Large Scale Visual Recognition Challenge. International Journal of Computer Vision (IJCV),115(3):211–252,,,2015,,"O. Russakovsky, J. Deng, H. Su, J. Krause, S. Satheesh, S. Ma, Z. Huang, A. Karpathy, A. Khosla, M. Bernstein, A. C. Berg, and L. Fei-Fei. ImageNet Large Scale Visual Recognition Challenge. International Journal of Computer Vision (IJCV), 115(3):211–252, 2015",./refs/download/Hashnet: Deep learning to hash by continuation.pdf,
0,,,,,,,,"B. Kulis and T. Darrell. Learning to hash with binary reconstructive embeddings. In NIPS, pages 1042",./refs/download/Hashnet: Deep learning to hash by continuation.pdf,
0,R. Salakhutdinov and G. E. Hinton. Learning a nonlinear embedding by preserving class neighbourhood structure. In AISTATS,pages 412–419,,,,2007,,"R. Salakhutdinov and G. E. Hinton. Learning a nonlinear embedding by preserving class neighbourhood structure. In AISTATS, pages 412–419, 2007",./refs/download/Hashnet: Deep learning to hash by continuation.pdf,
0,,,,,,,,"F. Shen, C. Shen, W. Liu, and H. Tao Shen. Supervised discrete hashing. In CVPR. IEEE, June 2015",./refs/download/Hashnet: Deep learning to hash by continuation.pdf,
0,,,,,,,,"A. W. Smeulders, M. Worring, S. Santini, A. Gupta, and R. Jain. Content-based image retrieval at the end of the early years. IEEE Transactions on Pattern Analysis and Machine Intelligence (TPAMI), 22(12):1349– 1380",./refs/download/Hashnet: Deep learning to hash by continuation.pdf,
0,,,,,,,,"N. Srivastava, G. Hinton, A. Krizhevsky, I. Sutskever, and R. Salakhutdinov. Dropout: A simple way to prevent neural networks from overfitting. Journal of Machine Learning Research (JMLR), 15(1):1929–1958, Jan. 2014",./refs/download/Hashnet: Deep learning to hash by continuation.pdf,
0,"J. Wang, S. Kumar, and S.-F. Chang. Semi-supervised hashing for large-scale search. IEEE Transactions on Pattern Analysis and Machine Intelligence (TPAMI)",34(12):2393–2406,,,,2012,,"J. Wang, S. Kumar, and S.-F. Chang. Semi-supervised hashing for large-scale search. IEEE Transactions on Pattern Analysis and Machine Intelligence (TPAMI), 34(12):2393–2406, 2012",./refs/download/Hashnet: Deep learning to hash by continuation.pdf,
0,"J. Wang, H. T. Shen",J. Song,and J. Ji. Hashing for similarity search: A survey. Arxiv,,,2014,,"J. Wang, H. T. Shen, J. Song, and J. Ji. Hashing for similarity search: A survey. Arxiv, 2014",./refs/download/Hashnet: Deep learning to hash by continuation.pdf,
0,"Y. Weiss, A. Torralba",and R. Fergus. Spectral hashing. In NIPS,,,,2009,,"Y. Weiss, A. Torralba, and R. Fergus. Spectral hashing. In NIPS, 2009",./refs/download/Hashnet: Deep learning to hash by continuation.pdf,
0,,,,,,,,"R. Xia, Y. Pan, H. Lai, C. Liu, and S. Yan. Supervised hashing for image retrieval via image representation learning. In AAAI, pages 2156",./refs/download/Hashnet: Deep learning to hash by continuation.pdf,
0,"X. Yu, S. Kumar, Y. Gong, and S.-F. Chang. Circulant binary embedding. In ICML",pages 353–360. ACM,,,,2014,,"F. X. Yu, S. Kumar, Y. Gong, and S.-F. Chang. Circulant binary embedding. In ICML, pages 353–360. ACM, 2014",./refs/download/Hashnet: Deep learning to hash by continuation.pdf,
0,"P. Zhang, W. Zhang, W.-J. Li, and M. Guo. Supervised hashing with latent factor models. In SIGIR",pages 173–182. ACM,,,,2014,,"P. Zhang, W. Zhang, W.-J. Li, and M. Guo. Supervised hashing with latent factor models. In SIGIR, pages 173–182. ACM, 2014",./refs/download/Hashnet: Deep learning to hash by continuation.pdf,
0,,,,,,,,"F. Zhao, Y. Huang, L. Wang, and T. Tan. Deep semantic ranking based hashing for multi-label image retrieval. In CVPR, pages 1556",./refs/download/Hashnet: Deep learning to hash by continuation.pdf,
0,"H. Zhu, M. Long, J. Wang",and Y. Cao. Deep hashing network for efficient similarity retrieval. In AAAI. AAAI,,,,2016,,"H. Zhu, M. Long, J. Wang, and Y. Cao. Deep hashing network for efficient similarity retrieval. In AAAI. AAAI, 2016",./refs/download/Hashnet: Deep learning to hash by continuation.pdf,
0,,,,,,,,"contains a “large” dataset with around 9,000 models consisting of models from a variety of sources organized into 171 categories (Table 1).  3. ShapeNet: An Information-Rich 3D Model Repository ShapeNet is a large, information-rich repository of 3D models. It contains models spanning a multitude of semantic categories. Unlike previous 3D model repositories, it provides extensive sets of annotations for every model and links between models in the repository and other multimedia data outside the repository. Like ImageNet, ShapeNet provides a view of the contained data in a hierarchical categorization according to WordNet synsets (Figure 1). Unlike other model repositories, ShapeNet also provides a rich set of annotations for 2  Benchmarks SHREC14LSGTB  Types  # models  # classes  Avg # models per class  Generic  8,987  171  53  PSB Generic 907+907 (train+test) 90+92 (train+test) 10+10 (train+test) SHREC12GTB Generic 1200",./refs/download/Shapenet: An information-rich 3d model repository.pdf,
