,authors,title,journal,publisher,volume,year,pages,full_ref,source_file,source_title
0,"He, K., Zhang, X., Ren, S., Sun, J.",Deep residual learning for image recognition,CVPR,,,2016,pp. 770–778,"He, K., Zhang, X., Ren, S., and Sun, J. Deep residual learning for image recognition. CVPR, pp. 770–778, 2016.",./refs/download/Efficientnet: Rethinking model scaling for convolutional neural networks.pdf,
0,"He, K., Gkioxari, G., Dollár, P., Girshick, R.",Mask r-cnn,ICCV,,,2017,pp. 2980–2988,"He, K., Gkioxari, G., Dollár, P., and Girshick, R. Mask r-cnn. ICCV, pp. 2980–2988, 2017.",./refs/download/Efficientnet: Rethinking model scaling for convolutional neural networks.pdf,
0,"He, Y., Lin, J., Liu, Z., Wang, H., Li, L.-J., Han, S.",Amc: Automl for model compression and acceleration on mobile devices,ECCV,,,2018,,"He, Y., Lin, J., Liu, Z., Wang, H., Li, L.-J., and Han, S. Amc: Automl for model compression and acceleration on mobile devices. ECCV, 2018.",./refs/download/Efficientnet: Rethinking model scaling for convolutional neural networks.pdf,
0,"Hendrycks, D., Gimpel, K.",Gaussian error linear units (gelus),arXiv preprint arXiv:1606.08415,,,2016,,"Hendrycks, D. and Gimpel, K. Gaussian error linear units (gelus). arXiv preprint arXiv:1606.08415, 2016.",./refs/download/Efficientnet: Rethinking model scaling for convolutional neural networks.pdf,
0,"Howard, A. G., Zhu, M., Chen, B., Kalenichenko, D., Wang, W., Weyand, T., Andreetto, M., Adam, H.",Mobilenets: Efficient convolutional neural networks for mobile vision applications,arXiv preprint arXiv:1704.04861,,,2017,,"Howard, A. G., Zhu, M., Chen, B., Kalenichenko, D., Wang, W., Weyand, T., Andreetto, M., and Adam, H. Mobilenets: Efficient convolutional neural networks for mobile vision applications. arXiv preprint arXiv:1704.04861, 2017.",./refs/download/Efficientnet: Rethinking model scaling for convolutional neural networks.pdf,
0,"Hu, J., Shen, L., Sun, G.",Squeeze-and-excitation networks,CVPR,,,2018,,"Hu, J., Shen, L., and Sun, G. Squeeze-and-excitation networks. CVPR, 2018.",./refs/download/Efficientnet: Rethinking model scaling for convolutional neural networks.pdf,
0,"Huang, G., Sun, Y., Liu, Z., Sedra, D., Weinberger, K. Q.",Deep networks with stochastic depth,ECCV,,,2016,pp. 646–661,"Huang, G., Sun, Y., Liu, Z., Sedra, D., and Weinberger, K. Q. Deep networks with stochastic depth. ECCV, pp. 646–661, 2016.",./refs/download/Efficientnet: Rethinking model scaling for convolutional neural networks.pdf,
0,"Maaten, L., Weinberger, K. Q.",Densely connected convolutional networks,CVPR,,,2017,,"Maaten, L., and Weinberger, K. Q. Densely connected convolutional networks. CVPR, 2017.",./refs/download/Efficientnet: Rethinking model scaling for convolutional neural networks.pdf,
0,"Huang, Y., Cheng, Y., Chen, D., Lee, H., Ngiam, J., Le, Q. V., Chen, Z.",Gpipe: Efficient training of giant neural networks using pipeline parallelism,arXiv preprint arXiv:1808.07233,,,2018,,"Huang, Y., Cheng, Y., Chen, D., Lee, H., Ngiam, J., Le, Q. V., and Chen, Z. Gpipe: Efficient training of giant neural networks using pipeline parallelism. arXiv preprint arXiv:1808.07233, 2018.",./refs/download/Efficientnet: Rethinking model scaling for convolutional neural networks.pdf,
0,"Iandola, F. N., Han, S., Moskewicz, M. W., Ashraf, K., Dally, W. J.",", and Keutzer, K",Squeezenet: Alexnet-level accuracy with 50x fewer parameters and <0.5 mb model size. arXiv preprint arXiv:1602.07360,,,2016,,"Iandola, F. N., Han, S., Moskewicz, M. W., Ashraf, K., Dally, W. J., and Keutzer, K. Squeezenet: Alexnet-level accuracy with 50x fewer parameters and <0.5 mb model size. arXiv preprint arXiv:1602.07360, 2016.",./refs/download/Efficientnet: Rethinking model scaling for convolutional neural networks.pdf,
0,"Ioffe, S., Szegedy, C.",Batch normalization: Accelerating deep network training by reducing internal covariate shift,ICML,,,2015,pp. 448–456,"Ioffe, S. and Szegedy, C. Batch normalization: Accelerating deep network training by reducing internal covariate shift. ICML, pp. 448–456, 2015.",./refs/download/Efficientnet: Rethinking model scaling for convolutional neural networks.pdf,
0,"Raghu, M., Poole, B., Kleinberg, J., Ganguli, S., SohlDickstein, J.",On the expressive power of deep neural networks,ICML,,,2017,,"Raghu, M., Poole, B., Kleinberg, J., Ganguli, S., and SohlDickstein, J. On the expressive power of deep neural networks. ICML, 2017.",./refs/download/Efficientnet: Rethinking model scaling for convolutional neural networks.pdf,
0,"Kornblith, S., Shlens, J., Le, Q.",V,Do better imagenet models transfer better? CVPR,,,2019,,"Kornblith, S., Shlens, J., and Le, Q. V. Do better imagenet models transfer better? CVPR, 2019.",./refs/download/Efficientnet: Rethinking model scaling for convolutional neural networks.pdf,
0,"Ramachandran, P., Zoph, B., Le, Q. V.",Searching for activation functions,arXiv preprint arXiv:1710.05941,,,2018,,"Ramachandran, P., Zoph, B., and Le, Q. V. Searching for activation functions. arXiv preprint arXiv:1710.05941, 2018.",./refs/download/Efficientnet: Rethinking model scaling for convolutional neural networks.pdf,
0,"Krause, J., Deng, J., Stark, M., Fei-Fei, L.",Collecting a large-scale dataset of fine-grained cars,Second Workshop on Fine-Grained Visual Categorizatio,,,2013,,"Krause, J., Deng, J., Stark, M., and Fei-Fei, L. Collecting a large-scale dataset of fine-grained cars. Second Workshop on Fine-Grained Visual Categorizatio, 2013.",./refs/download/Efficientnet: Rethinking model scaling for convolutional neural networks.pdf,
0,"Krizhevsky, A., Hinton, G.",Learning multiple layers of features from tiny images,Technical Report,,,2009,,"Krizhevsky, A. and Hinton, G. Learning multiple layers of features from tiny images. Technical Report, 2009.",./refs/download/Efficientnet: Rethinking model scaling for convolutional neural networks.pdf,
0,"Real, E., Aggarwal, A., Huang, Y., Le, Q. V.",Regularized evolution for image classifier architecture search,AAAI,,,2019,,"Real, E., Aggarwal, A., Huang, Y., and Le, Q. V. Regularized evolution for image classifier architecture search. AAAI, 2019.",./refs/download/Efficientnet: Rethinking model scaling for convolutional neural networks.pdf,
0,"Krizhevsky, A., Sutskever, I., Hinton, G. E.",Imagenet classification with deep convolutional neural networks,In NIPS,,,2012,pp. 1097–1105,"Krizhevsky, A., Sutskever, I., and Hinton, G. E. Imagenet classification with deep convolutional neural networks. In NIPS, pp. 1097–1105, 2012.",./refs/download/Efficientnet: Rethinking model scaling for convolutional neural networks.pdf,
0,"Lin, H., Jegelka, S.",Resnet with one-neuron hidden layers is a universal approximator,NeurIPS,,,2018,pp. 6172– 6181,"Lin, H. and Jegelka, S. Resnet with one-neuron hidden layers is a universal approximator. NeurIPS, pp. 6172– 6181, 2018.",./refs/download/Efficientnet: Rethinking model scaling for convolutional neural networks.pdf,
0,"Sandler, M., Howard, A., Zhu, M., Zhmoginov, A., Chen, L.-C.",Mobilenetv2: Inverted residuals and linear bottlenecks,CVPR,,,2018,,"Sandler, M., Howard, A., Zhu, M., Zhmoginov, A., and Chen, L.-C. Mobilenetv2: Inverted residuals and linear bottlenecks. CVPR, 2018.",./refs/download/Efficientnet: Rethinking model scaling for convolutional neural networks.pdf,
0,"Lin, T.-Y., Dollár, P., Girshick, R., He, K., Hariharan, B., Belongie, S.",Feature pyramid networks for object detection,CVPR,,,2017,,"Lin, T.-Y., Dollár, P., Girshick, R., He, K., Hariharan, B., and Belongie, S. Feature pyramid networks for object detection. CVPR, 2017.",./refs/download/Efficientnet: Rethinking model scaling for convolutional neural networks.pdf,
0,"Sharir, O., Shashua, A.",On the expressive power of overlapping architectures of deep learning,ICLR,,,2018,,"Sharir, O. and Shashua, A. On the expressive power of overlapping architectures of deep learning. ICLR, 2018.",./refs/download/Efficientnet: Rethinking model scaling for convolutional neural networks.pdf,
0,"Liu, C., Zoph, B., Shlens, J., Hua, W., Li, L.-J., Fei-Fei, L., Yuille, A., Huang, J., Murphy, K.",Progressive neural architecture search,ECCV,,,2018,,"Liu, C., Zoph, B., Shlens, J., Hua, W., Li, L.-J., Fei-Fei, L., Yuille, A., Huang, J., and Murphy, K. Progressive neural architecture search. ECCV, 2018.",./refs/download/Efficientnet: Rethinking model scaling for convolutional neural networks.pdf,
0,"Srivastava, N., Hinton, G., Krizhevsky, A., Sutskever, I., Salakhutdinov, R.",Dropout: a simple way to prevent neural networks from overfitting,The Journal of Machine Learning Research,,,2014,15(1):1929–1958,"Srivastava, N., Hinton, G., Krizhevsky, A., Sutskever, I., and Salakhutdinov, R. Dropout: a simple way to prevent neural networks from overfitting. The Journal of Machine Learning Research, 15(1):1929–1958, 2014.",./refs/download/Efficientnet: Rethinking model scaling for convolutional neural networks.pdf,
0,"Lu, Z., Pu, H., Wang, F., Hu, Z., Wang, L.",The expressive power of neural networks: A view from the width,NeurIPS,,,2018,,"Lu, Z., Pu, H., Wang, F., Hu, Z., and Wang, L. The expressive power of neural networks: A view from the width. NeurIPS, 2018.",./refs/download/Efficientnet: Rethinking model scaling for convolutional neural networks.pdf,
0,"Ma, N., Zhang, X., Zheng, H.-T., Sun, J.",Shufflenet v2: Practical guidelines for efficient cnn architecture design,ECCV,,,2018,,"Ma, N., Zhang, X., Zheng, H.-T., and Sun, J. Shufflenet v2: Practical guidelines for efficient cnn architecture design. ECCV, 2018.",./refs/download/Efficientnet: Rethinking model scaling for convolutional neural networks.pdf,
0,"Mahajan, D., Girshick, R., Ramanathan, V., He, K., Paluri, M., Li, Y., Bharambe, A.",", and van der Maaten, L",Exploring the limits of weakly supervised pretraining. arXiv preprint arXiv:1805.00932,,,2018,,"Mahajan, D., Girshick, R., Ramanathan, V., He, K., Paluri, M., Li, Y., Bharambe, A., and van der Maaten, L. Exploring the limits of weakly supervised pretraining. arXiv preprint arXiv:1805.00932, 2018.",./refs/download/Efficientnet: Rethinking model scaling for convolutional neural networks.pdf,
0,"Szegedy, C., Liu, W., Jia, Y., Sermanet, P., Reed, S., Anguelov, D., Erhan, D., Vanhoucke, V., Rabinovich, A.",Going deeper with convolutions,CVPR,,,2015,pp. 1–9,"Szegedy, C., Liu, W., Jia, Y., Sermanet, P., Reed, S., Anguelov, D., Erhan, D., Vanhoucke, V., and Rabinovich, A. Going deeper with convolutions. CVPR, pp. 1–9, 2015.",./refs/download/Efficientnet: Rethinking model scaling for convolutional neural networks.pdf,
0,"Szegedy, C., Vanhoucke, V., Ioffe, S., Shlens, J., Wojna, Z.",Rethinking the inception architecture for computer vision,CVPR,,,2016,pp. 2818–2826,"Szegedy, C., Vanhoucke, V., Ioffe, S., Shlens, J., and Wojna, Z. Rethinking the inception architecture for computer vision. CVPR, pp. 2818–2826, 2016.",./refs/download/Efficientnet: Rethinking model scaling for convolutional neural networks.pdf,
0,"Szegedy, C., Ioffe, S., Vanhoucke, V., Alemi, A. A.","Inception-v4, inception-resnet and the impact of residual connections on learning",AAAI,,,2017,4:12,"Szegedy, C., Ioffe, S., Vanhoucke, V., and Alemi, A. A. Inception-v4, inception-resnet and the impact of residual connections on learning. AAAI, 4:12, 2017.",./refs/download/Efficientnet: Rethinking model scaling for convolutional neural networks.pdf,
0,"Maji, S., Rahtu, E., Kannala, J., Blaschko, M., Vedaldi, A.",Fine-grained visual classification of aircraft,arXiv preprint arXiv:1306.5151,,,2013,,"Maji, S., Rahtu, E., Kannala, J., Blaschko, M., and Vedaldi, A. Fine-grained visual classification of aircraft. arXiv preprint arXiv:1306.5151, 2013.",./refs/download/Efficientnet: Rethinking model scaling for convolutional neural networks.pdf,
0,"Tan, M., Chen, B., Pang, R., Vasudevan, V., Sandler, M., Howard, A., Le, Q. V.",MnasNet: Platform-aware neural architecture search for mobile,CVPR,,,2019,,"Tan, M., Chen, B., Pang, R., Vasudevan, V., Sandler, M., Howard, A., and Le, Q. V. MnasNet: Platform-aware neural architecture search for mobile. CVPR, 2019.",./refs/download/Efficientnet: Rethinking model scaling for convolutional neural networks.pdf,
0,"Ngiam, J., Peng, D., Vasudevan, V., Kornblith, S., Le, Q. V., Pang, R.",Domain adaptive transfer learning with specialist models,arXiv preprint arXiv:1811.07056,,,2018,,"Ngiam, J., Peng, D., Vasudevan, V., Kornblith, S., Le, Q. V., and Pang, R. Domain adaptive transfer learning with specialist models. arXiv preprint arXiv:1811.07056, 2018.",./refs/download/Efficientnet: Rethinking model scaling for convolutional neural networks.pdf,
0,"Xie, S., Girshick, R., Dollár, P., Tu, Z., He, K.",Aggregated residual transformations for deep neural networks,CVPR,,,2017,pp. 5987–5995,"Xie, S., Girshick, R., Dollár, P., Tu, Z., and He, K. Aggregated residual transformations for deep neural networks. CVPR, pp. 5987–5995, 2017.",./refs/download/Efficientnet: Rethinking model scaling for convolutional neural networks.pdf,
0,"Nilsback, M.-E., Zisserman, A.",Automated flower classification over a large number of classes,ICVGIP,,,2008,pp. 722–729,"Nilsback, M.-E. and Zisserman, A. Automated flower classification over a large number of classes. ICVGIP, pp. 722–729, 2008.",./refs/download/Efficientnet: Rethinking model scaling for convolutional neural networks.pdf,
0,"Yang, T.-J., Howard, A., Chen, B., Zhang, X., Go, A., Sze, V., Adam, H.",Netadapt: Platform-aware neural network adaptation for mobile applications,ECCV,,,2018,,"Yang, T.-J., Howard, A., Chen, B., Zhang, X., Go, A., Sze, V., and Adam, H. Netadapt: Platform-aware neural network adaptation for mobile applications. ECCV, 2018.",./refs/download/Efficientnet: Rethinking model scaling for convolutional neural networks.pdf,
0,"Parkhi, O. M., Vedaldi, A., Zisserman, A., Jawahar, C.",Cats and dogs,CVPR,,,2012,pp. 3498–3505,"Parkhi, O. M., Vedaldi, A., Zisserman, A., and Jawahar, C. Cats and dogs. CVPR, pp. 3498–3505, 2012.",./refs/download/Efficientnet: Rethinking model scaling for convolutional neural networks.pdf,
0,"Zagoruyko, S., Komodakis, N.",Wide residual networks,BMVC,,,2016,,"Zagoruyko, S. and Komodakis, N. Wide residual networks. BMVC, 2016.",./refs/download/Efficientnet: Rethinking model scaling for convolutional neural networks.pdf,
0,"Zhang, X., Li, Z., Loy, C. C., Lin, D.",Polynet: A pursuit of structural diversity in very deep networks,CVPR,,,2017,pp. 3900–3908,"Zhang, X., Li, Z., Loy, C. C., and Lin, D. Polynet: A pursuit of structural diversity in very deep networks. CVPR, pp. 3900–3908, 2017.",./refs/download/Efficientnet: Rethinking model scaling for convolutional neural networks.pdf,
0,"Zhang, X., Zhou, X., Lin, M., Sun, J.",Shufflenet: An extremely efficient convolutional neural network for mobile devices,CVPR,,,2018,,"Zhang, X., Zhou, X., Lin, M., and Sun, J. Shufflenet: An extremely efficient convolutional neural network for mobile devices. CVPR, 2018.",./refs/download/Efficientnet: Rethinking model scaling for convolutional neural networks.pdf,
0,"Zhou, B., Khosla, A., Lapedriza, A., Oliva, A., Torralba, A.",Learning deep features for discriminative localization,CVPR,,,2016,pp. 2921–2929,"Zhou, B., Khosla, A., Lapedriza, A., Oliva, A., and Torralba, A. Learning deep features for discriminative localization. CVPR, pp. 2921–2929, 2016.",./refs/download/Efficientnet: Rethinking model scaling for convolutional neural networks.pdf,
0,"Zoph, B., Le, Q. V.",Neural architecture search with reinforcement learning,ICLR,,,2017,,"Zoph, B. and Le, Q. V. Neural architecture search with reinforcement learning. ICLR, 2017.",./refs/download/Efficientnet: Rethinking model scaling for convolutional neural networks.pdf,
0,"Zoph, B., Vasudevan, V., Shlens, J., Le, Q. V.",Learning transferable architectures for scalable image recognition,CVPR,,,2018,,"Zoph, B., Vasudevan, V., Shlens, J., and Le, Q. V. Learning transferable architectures for scalable image recognition. CVPR, 2018.",./refs/download/Efficientnet: Rethinking model scaling for convolutional neural networks.pdf,
0,,,,,,,,up to the inception (4e) block 3 whose output is a 7 × 7 feature map with 1024,./refs/download/A compact embedding for facial expression similarity.pdf,
0,"Y. Guo, L. Zhang, Y. Hu, X. He",and J. Gao. MS-Celeb-1M: A dataset and benchmark for large scale face recognition. In ECCV,,,,2016,,"Y. Guo, L. Zhang, Y. Hu, X. He, and J. Gao. MS-Celeb-1M: A dataset and benchmark for large scale face recognition. In ECCV, 2016",./refs/download/A compact embedding for facial expression similarity.pdf,
0,"X. He, Y. Zhou, Z. Zhou, S. Bai",and X. Bai. Triplet-center loss for multi-view 3D object retrieval. In CVPR,,,,2018,,"X. He, Y. Zhou, Z. Zhou, S. Bai, and X. Bai. Triplet-center loss for multi-view 3D object retrieval. In CVPR, 2018",./refs/download/A compact embedding for facial expression similarity.pdf,
0,"A. Hermans, L. Beyer, and B. Leibe. In defense of the triplet loss for person re-identification. CoRR",abs/1703.07737,,,,2017,,"A. Hermans, L. Beyer, and B. Leibe. In defense of the triplet loss for person re-identification. CoRR, abs/1703.07737, 2017",./refs/download/A compact embedding for facial expression similarity.pdf,
0,"G. Huang, Z. Liu, L. van der Maaten",and K. Q. Weinberger. Densely connected convolutional networks. In CVPR,,,,2017,,"G. Huang, Z. Liu, L. van der Maaten, and K. Q. Weinberger. Densely connected convolutional networks. In CVPR, 2017",./refs/download/A compact embedding for facial expression similarity.pdf,
0,,,,,,,,"S. Ioffe and C. Szegedy. Batch normalization: Accelerating deep network training by reducing internal covariate shift. In ICML, 2015",./refs/download/A compact embedding for facial expression similarity.pdf,
0,"I. Kemelmacher-Shlizerman, S. M. Seitz",D. Miller,and E. Brossard. The MegaFace benchmark: 1 million faces for recognition at scale. In CVPR,,,2016,,"I. Kemelmacher-Shlizerman, S. M. Seitz, D. Miller, and E. Brossard. The MegaFace benchmark: 1 million faces for recognition at scale. In CVPR, 2016",./refs/download/A compact embedding for facial expression similarity.pdf,
0,D. P. Kingma and J. Ba. Adam: A method for stochastic optimization. CoRR,abs/1412.6980,,,,2014,,"D. P. Kingma and J. Ba. Adam: A method for stochastic optimization. CoRR, abs/1412.6980, 2014",./refs/download/A compact embedding for facial expression similarity.pdf,
0,"M. Soleymani, J. Lee, A. Yazdani, T. Ebrahimi, T. Pun, A. Nijholt, and I. Patras. DEAP: A database for emotion analysis using physiological signals. IEEE Transactions on Affective Computing",3(1):18– 31,,,,2012,,"S. Koelstra, C. Mühl, M. Soleymani, J. Lee, A. Yazdani, T. Ebrahimi, T. Pun, A. Nijholt, and I. Patras. DEAP: A database for emotion analysis using physiological signals. IEEE Transactions on Affective Computing, 3(1):18– 31, 2012",./refs/download/A compact embedding for facial expression similarity.pdf,
0,A. S. Koepke,O. Wiles,and A. Zisserman. Self-supervised learning of a facial attribute embedding from video. In BMVC,,,2018,,"A. S. Koepke, O. Wiles, and A. Zisserman. Self-supervised learning of a facial attribute embedding from video. In BMVC, 2018",./refs/download/A compact embedding for facial expression similarity.pdf,
0,deep architectures,and beyond. CoRR,abs/1804.10938,,,2018,,"D. Kollias, P. Tzirakis, M. A. Nicolaou, A. Papaioannou, G. Zhao, B. W. Schuller, I. Kotsia, and S. Zafeiriou. Deep affect prediction in-the-wild: Aff-wild database and challenge, deep architectures, and beyond. CoRR, abs/1804.10938, 2018",./refs/download/A compact embedding for facial expression similarity.pdf,
0,"J. Kossaifi, G. Tzimiropoulos, S. Todorovic, and M. Pantic. AFEW-VA database for valence and arousal estimation inthe-wild. Image and Vision Computing",65:23–36,,,,2017,,"J. Kossaifi, G. Tzimiropoulos, S. Todorovic, and M. Pantic. AFEW-VA database for valence and arousal estimation inthe-wild. Image and Vision Computing, 65:23–36, 2017",./refs/download/A compact embedding for facial expression similarity.pdf,
0,,,,,,,,"A. Krizhevsky. Convolutional deep belief networks on CIFAR-10. Unpublished manuscript, 2010",./refs/download/A compact embedding for facial expression similarity.pdf,
0,S. Li and W. Deng. Deep facial expression recognition: A survey. CoRR,abs/1804.08348,,,,2018,,"S. Li and W. Deng. Deep facial expression recognition: A survey. CoRR, abs/1804.08348, 2018",./refs/download/A compact embedding for facial expression similarity.pdf,
0,S. Li and W. Deng. Reliable crowdsourcing and deep locality-preserving learning for unconstrained facial expression recognition. IEEE Transactions on Image Processing,28(1):356–370,,,,2019,,"S. Li and W. Deng. Reliable crowdsourcing and deep locality-preserving learning for unconstrained facial expression recognition. IEEE Transactions on Image Processing, 28(1):356–370, 2019",./refs/download/A compact embedding for facial expression similarity.pdf,
0,"H. Liu, Y. Tian, Y. Wang, L. Pang",and T. Huang. Deep relative distance learning: Tell the difference between similar vehicles. In CVPR,,,,2016,,"H. Liu, Y. Tian, Y. Wang, L. Pang, and T. Huang. Deep relative distance learning: Tell the difference between similar vehicles. In CVPR, 2016",./refs/download/A compact embedding for facial expression similarity.pdf,
0,"Z. Liu, P. Luo, X. Wang",and X. Tang. Deep learning face attributes in the wild. In ICCV,,,,2015,,"Z. Liu, P. Luo, X. Wang, and X. Tang. Deep learning face attributes in the wild. In ICCV, 2015",./refs/download/A compact embedding for facial expression similarity.pdf,
0,"F. Cohn, T. Kanade, J. M. Saragih",Z. Ambadar,and I. A. Matthews. The extended Cohn-Kanade dataset (CK+): A complete dataset for action unit and emotionspecified expression. In CVPR Workshops,,,2010,,"P. Lucey, J. F. Cohn, T. Kanade, J. M. Saragih, Z. Ambadar, and I. A. Matthews. The extended Cohn-Kanade dataset (CK+): A complete dataset for action unit and emotionspecified expression. In CVPR Workshops, 2010",./refs/download/A compact embedding for facial expression similarity.pdf,
0,"B. Martinez, M. F. Valstar",B. Jiang,and M. Pantic. Automatic analysis of facial actions: A survey. IEEE Transactions on Affective Computing,,,2017,,"B. Martinez, M. F. Valstar, B. Jiang, and M. Pantic. Automatic analysis of facial actions: A survey. IEEE Transactions on Affective Computing, 2017",./refs/download/A compact embedding for facial expression similarity.pdf,
0,Visualizing data using t-SNE. Journal of Machine Learning Research,9:2579–2605,,,,2008,,"Visualizing data using t-SNE. Journal of Machine Learning Research, 9:2579–2605, 2008",./refs/download/A compact embedding for facial expression similarity.pdf,
0,"F. Benitez-Quiroz, R. Srinivasan, and A. M. Martı́nez. Emotionet: An accurate",real-time algorithm for the automatic annotation of a million facial expressions in the wild. In CVPR,,,,2016,,"C. F. Benitez-Quiroz, R. Srinivasan, and A. M. Martı́nez. Emotionet: An accurate, real-time algorithm for the automatic annotation of a million facial expressions in the wild. In CVPR, 2016",./refs/download/A compact embedding for facial expression similarity.pdf,
0,"G. Chechik, V. Sharma, U. Shalit, and S. Bengio. Large scale online learning of image similarity through ranking. Journal of Machine Learning Research",11:1109–1135,,,,2010,,"G. Chechik, V. Sharma, U. Shalit, and S. Bengio. Large scale online learning of image similarity through ranking. Journal of Machine Learning Research, 11:1109–1135, 2010",./refs/download/A compact embedding for facial expression similarity.pdf,
0,C. A. Corneanu,M. Madadi,and S. Escalera. Deep structure inference network for facial action unit recognition. In ECCV,,,2018,,"C. A. Corneanu, M. Madadi, and S. Escalera. Deep structure inference network for facial action unit recognition. In ECCV, 2018",./refs/download/A compact embedding for facial expression similarity.pdf,
0,A. S. Cowen and D. Keltner. Self-report captures 27 distinct categories of emotion bridged by continuous gradients. Proceedings of the National Academy of Sciences,114(38):E7900E7909,,,,2017,,"A. S. Cowen and D. Keltner. Self-report captures 27 distinct categories of emotion bridged by continuous gradients. Proceedings of the National Academy of Sciences, 114(38):E7900E7909, 2017",./refs/download/A compact embedding for facial expression similarity.pdf,
0,dimensionality,and structure of emotion. Trends in Cognitive Sciences,22(4):274–276,,,2018,,"A. S. Cowen and D. Keltner. Clarifying the conceptualization, dimensionality, and structure of emotion. Trends in Cognitive Sciences, 22(4):274–276, 2018",./refs/download/A compact embedding for facial expression similarity.pdf,
0,"A. Dhall, R. Goecke, S. Ghosh, J. Joshi, J. Hoey",and T. Gedeon. From individual to group-level emotion recognition: Emotiw 5.0. In ICMI,,,,2017,,"A. Dhall, R. Goecke, S. Ghosh, J. Joshi, J. Hoey, and T. Gedeon. From individual to group-level emotion recognition: Emotiw 5.0. In ICMI, 2017",./refs/download/A compact embedding for facial expression similarity.pdf,
0,,,,,,,,"A. Dhall, R. Goecke, J. Joshi, M. Wagner, and T. Gedeon. Emotion recognition in the wild challenge 2013",./refs/download/A compact embedding for facial expression similarity.pdf,
0,,,,,,,,"A. Dhall, O. V. R. Murthy, R. Goecke, J. Joshi, and T. Gedeon. Video and image based emotion recognition challenges in the wild: Emotiw 2015",./refs/download/A compact embedding for facial expression similarity.pdf,
0,"P. Ekman, W. V. Friesen",and J. C. Hager. Facial Action Coding System - Manual. A Human Face,,,,2002,,"P. Ekman, W. V. Friesen, and J. C. Hager. Facial Action Coding System - Manual. A Human Face, 2002",./refs/download/A compact embedding for facial expression similarity.pdf,
