,authors,title,journal,publisher,volume,year,pages,full_ref,source_file,source_title
0,,,,,,,,"helps users to identify candidate queries when only prefixes are input. It significantly improves the efficiency of query generation since users are only required to input a few characters. In Fashionista, the server maintains a trie for all item identifiers in its main memory. Every time a new character is entered, an Ajax request is sent to the server which looks up the trie and returns a list of candidate items with a matching prefix. In addition, the server also returns the corresponding icon images for the candidate items to provide a preview in the item id input text box.  2.2.2  Fashion Trend Exhibitor  The fashion trend exhibitor surfaces a plot of the fashionability scores of the query image from the year of 2006",./refs/download/Fashionista: A fashion-aware graphical system for exploring visually similar items.pdf,
0,,,,,,,,"J. J. McAuley, C. Targett, Q. Shi, and A. van den Hengel, “Image-based recommendations on styles and substitutes,” in SIGIR, 2015",./refs/download/Fashionista: A fashion-aware graphical system for exploring visually similar items.pdf,
0,,,,,,,,"R. He and J. McAuley, “Ups and downs: Modeling the visual evolution of fashion trends with one-class collaborative filtering,” in WWW, 2016",./refs/download/Fashionista: A fashion-aware graphical system for exploring visually similar items.pdf,
0,,,,,,,,"R. He and J. McAuley, “VBPR: visual bayesian personalized ranking from implicit feedback,” in AAAI, 2016",./refs/download/Fashionista: A fashion-aware graphical system for exploring visually similar items.pdf,
0,,,,,,,,"C. Lin, J. Lu, T. W. Ling, and B. Cautis, “Lotusx: a position-aware xml graphical search system with auto-completion,” in ICDE, 2012",./refs/download/Fashionista: A fashion-aware graphical system for exploring visually similar items.pdf,
0,,,,,,,,"A. Krizhevsky, I. Sutskever, and G. E. Hinton, “Imagenet classification with deep convolutional neural networks,” in NIPS, 2012",./refs/download/Fashionista: A fashion-aware graphical system for exploring visually similar items.pdf,
0,,,,,,,,"R. Pan, Y. Zhou, B. Cao, N. N. Liu, R. Lukose, M. Scholz, and Q. Yang, “One-class collaborative filtering,” in ICDM, 2008",./refs/download/Fashionista: A fashion-aware graphical system for exploring visually similar items.pdf,
0,,,,,,,,"L. van der Maaten, “Accelerating t-SNE using tree-based algorithms,” JMLR, 2014",./refs/download/Fashionista: A fashion-aware graphical system for exploring visually similar items.pdf,
0,"Han, X., Wu, Z., Wu, Z., Yu, R., Davis, L. S.",Viton: An image-based virtual try-on network,arXiv preprint arXiv:1711.08447,,,2017,,"Han, X., Wu, Z., Wu, Z., Yu, R., and Davis, L. S. Viton: An image-based virtual try-on network. arXiv preprint arXiv:1711.08447, 2017.",./refs/download/Fashion-gen: The generative fashion dataset and challenge.pdf,
0,"Huang, X., Li, Y., Poursaeed, O., Hopcroft, J., Belongie, S.",Stacked generative adversarial networks,In IEEE Conference on Computer Vision and Pattern Recognition (CVPR),,,2017,"volume 2, pp. 4","Huang, X., Li, Y., Poursaeed, O., Hopcroft, J., and Belongie, S. Stacked generative adversarial networks. In IEEE Conference on Computer Vision and Pattern Recognition (CVPR), volume 2, pp. 4, 2017.",./refs/download/Fashion-gen: The generative fashion dataset and challenge.pdf,
0,"Isola, P., Zhu, J.-Y., Zhou, T., Efros, A. A.",Image-toimage translation with conditional adversarial networks,arXiv preprint,,,2017,,"Isola, P., Zhu, J.-Y., Zhou, T., and Efros, A. A. Image-toimage translation with conditional adversarial networks. arXiv preprint, 2017.",./refs/download/Fashion-gen: The generative fashion dataset and challenge.pdf,
0,"Kalantidis, Y., Kennedy, L., Li, L.-J.",Getting the look: clothing recognition and segmentation for automatic product suggestions in everyday photos,In Proceedings of the 3rd ACM conference on International conference on multimedia retrieval,. ACM,,2013,pp. 105–112,"Kalantidis, Y., Kennedy, L., and Li, L.-J. Getting the look: clothing recognition and segmentation for automatic product suggestions in everyday photos. In Proceedings of the 3rd ACM conference on International conference on multimedia retrieval, pp. 105–112. ACM, 2013.",./refs/download/Fashion-gen: The generative fashion dataset and challenge.pdf,
0,"Karras, T., Aila, T., Laine, S., Lehtinen, J.","Progressive growing of gans for improved quality, stability, and variation",arXiv preprint arXiv:1710.10196,,,2017,,"Karras, T., Aila, T., Laine, S., and Lehtinen, J. Progressive growing of gans for improved quality, stability, and variation. arXiv preprint arXiv:1710.10196, 2017.",./refs/download/Fashion-gen: The generative fashion dataset and challenge.pdf,
0,"Barratt, S., Sharma, R.",A note on the inception score,arXiv preprint arXiv:1801.01973,,,2018,,"Barratt, S. and Sharma, R. A note on the inception score. arXiv preprint arXiv:1801.01973, 2018.",./refs/download/Fashion-gen: The generative fashion dataset and challenge.pdf,
0,"Kiapour, M. H., Han, X., Lazebnik, S., Berg, A. C., Berg, T. L.",Where to buy it: Matching street clothing photos in online shops,In ICCV,,,2015,pp. 3343–3351,"Kiapour, M. H., Han, X., Lazebnik, S., Berg, A. C., and Berg, T. L. Where to buy it: Matching street clothing photos in online shops. In ICCV, pp. 3343–3351, 2015.",./refs/download/Fashion-gen: The generative fashion dataset and challenge.pdf,
0,"Belghazi, M. I., Rajeswar, S., Mastropietro, O., Rostamzadeh, N., Mitrovic, J., Courville, A.",Hierarchical adversarially learned inference,arXiv preprint arXiv:1802.01071,,,2018,,"Belghazi, M. I., Rajeswar, S., Mastropietro, O., Rostamzadeh, N., Mitrovic, J., and Courville, A. Hierarchical adversarially learned inference. arXiv preprint arXiv:1802.01071, 2018.",./refs/download/Fashion-gen: The generative fashion dataset and challenge.pdf,
0,"Bossard, L., Dantone, M., Leistner, C., Wengert, C., Quack, T.",", and Van Gool, L",Apparel classification with style. In Asian conference on computer vision,. Springer,,2012,pp. 321–335,"Bossard, L., Dantone, M., Leistner, C., Wengert, C., Quack, T., and Van Gool, L. Apparel classification with style. In Asian conference on computer vision, pp. 321–335. Springer, 2012.",./refs/download/Fashion-gen: The generative fashion dataset and challenge.pdf,
0,"Liang, X., Lin, L., Yang, W., Luo, P., Huang, J., Yan, S.",Clothes co-parsing via joint image segmentation and labeling with application to clothing retrieval,IEEE Transactions on Multimedia,,,2016,18(6):1175–1186,"Liang, X., Lin, L., Yang, W., Luo, P., Huang, J., and Yan, S. Clothes co-parsing via joint image segmentation and labeling with application to clothing retrieval. IEEE Transactions on Multimedia, 18(6):1175–1186, 2016.",./refs/download/Fashion-gen: The generative fashion dataset and challenge.pdf,
0,"Chen, H., Gallagher, A., Girod, B.",Describing clothing by semantic attributes,In European conference on computer vision,. Springer,,2012,pp. 609–623,"Chen, H., Gallagher, A., and Girod, B. Describing clothing by semantic attributes. In European conference on computer vision, pp. 609–623. Springer, 2012.",./refs/download/Fashion-gen: The generative fashion dataset and challenge.pdf,
0,"Lin, T.-Y., Maire, M., Belongie, S., Hays, J., Perona, P., Ramanan, D., Dollár, P., Zitnick, C. L.",Microsoft coco: Common objects in context,In European conference on computer vision,. Springer,,2014,pp. 740–755,"Lin, T.-Y., Maire, M., Belongie, S., Hays, J., Perona, P., Ramanan, D., Dollár, P., and Zitnick, C. L. Microsoft coco: Common objects in context. In European conference on computer vision, pp. 740–755. Springer, 2014.",./refs/download/Fashion-gen: The generative fashion dataset and challenge.pdf,
0,"Chen, Q., Huang, J., Feris, R., Brown, L. M., Dong, J., Yan, S.",Deep domain adaptation for describing people based on fine-grained clothing attributes,In Computer Vision and Pattern Recognition (CVPR),. IEEE,,2015,"2015 IEEE Conference on, pp. 5315–5324","Chen, Q., Huang, J., Feris, R., Brown, L. M., Dong, J., and Yan, S. Deep domain adaptation for describing people based on fine-grained clothing attributes. In Computer Vision and Pattern Recognition (CVPR), 2015 IEEE Conference on, pp. 5315–5324. IEEE, 2015.",./refs/download/Fashion-gen: The generative fashion dataset and challenge.pdf,
0,"Denton, E., Fergus, R.",Stochastic video generation with a learned prior,arXiv preprint arXiv:1802.07687,,,2018,,"Denton, E. and Fergus, R. Stochastic video generation with a learned prior. arXiv preprint arXiv:1802.07687, 2018.",./refs/download/Fashion-gen: The generative fashion dataset and challenge.pdf,
0,"Liu, S., Song, Z., Liu, G., Xu, C., Lu, H., Yan, S.",Street-to-shop: Cross-scenario clothing retrieval via parts alignment and auxiliary set,In Computer Vision and Pattern Recognition (CVPR),. IEEE,,2012,"2012 IEEE Conference on, pp. 3330–3337","Liu, S., Song, Z., Liu, G., Xu, C., Lu, H., and Yan, S. Street-to-shop: Cross-scenario clothing retrieval via parts alignment and auxiliary set. In Computer Vision and Pattern Recognition (CVPR), 2012 IEEE Conference on, pp. 3330–3337. IEEE, 2012.",./refs/download/Fashion-gen: The generative fashion dataset and challenge.pdf,
0,"Liu, Z., Luo, P., Wang, X., Tang, X.",Deep learning face attributes in the wild,In Proceedings of the IEEE International Conference on Computer Vision,,,2015,pp. 3730– 3738,"Liu, Z., Luo, P., Wang, X., and Tang, X. Deep learning face attributes in the wild. In Proceedings of the IEEE International Conference on Computer Vision, pp. 3730– 3738, 2015.",./refs/download/Fashion-gen: The generative fashion dataset and challenge.pdf,
0,"Liu, Z., Luo, P., Qiu, S., Wang, X., Tang, X.",Deepfashion: Powering robust clothes recognition and retrieval  Fashion-Gen: The Generative Fashion Dataset and Challenge  with rich annotations,In Proceedings of the IEEE Conference on Computer Vision and Pattern Recognition,,,2016,pp. 1096–1104,"Goodfellow, I., Pouget-Abadie, J., Mirza, M., Xu, B., Warde-Farley, D., Ozair, S., Courville, A., and Bengio,  Liu, Z., Luo, P., Qiu, S., Wang, X., and Tang, X. Deepfashion: Powering robust clothes recognition and retrieval  Fashion-Gen: The Generative Fashion Dataset and Challenge  with rich annotations. In Proceedings of the IEEE Conference on Computer Vision and Pattern Recognition, pp. 1096–1104, 2016.",./refs/download/Fashion-gen: The generative fashion dataset and challenge.pdf,
0,,,,,,,,"Nilsback, M.-E. and Zisserman, A. Automated flower classification over a large number of classes. In Computer Vision, Graphics & Image Processing, 2008.",./refs/download/Fashion-gen: The generative fashion dataset and challenge.pdf,
0,"Reed, S., Akata, Z., Yan, X., Logeswaran, L., Schiele, B., Lee, H.",Generative adversarial text to image synthesis,arXiv preprint arXiv:1605.05396,,,2016,"2016a. Reed, S., Akata, Z., Lee, H., and Schiele, B. Learning deep representations of fine-grained visual descriptions. In Proceedings of the IEEE Conference on Computer Vision and Pattern Recognition, pp. 49–58, 2016b. Reed, S. E., Akata, Z., Schiele, B., and Lee, H. Learning deep representations of fine-grained visual descriptions. CoRR, abs/1605.05395","Reed, S., Akata, Z., Yan, X., Logeswaran, L., Schiele, B., and Lee, H. Generative adversarial text to image synthesis. arXiv preprint arXiv:1605.05396, 2016a. Reed, S., Akata, Z., Lee, H., and Schiele, B. Learning deep representations of fine-grained visual descriptions. In Proceedings of the IEEE Conference on Computer Vision and Pattern Recognition, pp. 49–58, 2016b. Reed, S. E., Akata, Z., Schiele, B., and Lee, H. Learning deep representations of fine-grained visual descriptions. CoRR, abs/1605.05395, 2016.",./refs/download/Fashion-gen: The generative fashion dataset and challenge.pdf,
0,"Salimans, T., Goodfellow, I., Zaremba, W., Cheung, V., Radford, A., Chen, X.",Improved techniques for training gans,In Advances in Neural Information Processing Systems,,,2016,pp. 2234–2242,"Salimans, T., Goodfellow, I., Zaremba, W., Cheung, V., Radford, A., and Chen, X. Improved techniques for training gans. In Advances in Neural Information Processing Systems, pp. 2234–2242, 2016.",./refs/download/Fashion-gen: The generative fashion dataset and challenge.pdf,
0,"Schuster, M., Paliwal, K. K., General, A.",Bidirectional recurrent neural networks,IEEE Transactions on Signal Processing,,,1997,,"Schuster, M., Paliwal, K. K., and General, A. Bidirectional recurrent neural networks. IEEE Transactions on Signal Processing, 1997.",./refs/download/Fashion-gen: The generative fashion dataset and challenge.pdf,
0,"Simo-Serra, E., Fidler, S., Moreno-Noguer, F., Urtasun, R.",Neuroaesthetics in fashion: Modeling the perception of fashionability,In CVPR,,,2015,"volume 2, pp. 6","Simo-Serra, E., Fidler, S., Moreno-Noguer, F., and Urtasun, R. Neuroaesthetics in fashion: Modeling the perception of fashionability. In CVPR, volume 2, pp. 6, 2015.",./refs/download/Fashion-gen: The generative fashion dataset and challenge.pdf,
0,"Sønderby, C. K., Caballero, J., Theis, L., Shi, W., Huszár, F.",Amortised map inference for image superresolution,arXiv preprint arXiv:1610.04490,,,2016,,"Sønderby, C. K., Caballero, J., Theis, L., Shi, W., and Huszár, F. Amortised map inference for image superresolution. arXiv preprint arXiv:1610.04490, 2016.",./refs/download/Fashion-gen: The generative fashion dataset and challenge.pdf,
0,"Taigman, Y., Polyak, A., Wolf, L.",Unsupervised cross-domain image generation,arXiv preprint arXiv:1611.02200,,,2016,,"Taigman, Y., Polyak, A., and Wolf, L. Unsupervised cross-domain image generation. arXiv preprint arXiv:1611.02200, 2016.",./refs/download/Fashion-gen: The generative fashion dataset and challenge.pdf,
0,"Maaten, L., Hinton, G.",Visualizing data using t-SNE,Journal of Machine Learning Research,,,2008,9: 2579–2605,"Maaten, L. and Hinton, G. Visualizing data using t-SNE. Journal of Machine Learning Research, 9: 2579–2605, 2008.",./refs/download/Fashion-gen: The generative fashion dataset and challenge.pdf,
0,"Vaswani, A., Shazeer, N., Parmar, N., Uszkoreit, J., Jones, L., Gomez, A. N., Kaiser, L., Polosukhin, I.",Attention is all you need,CoRR,,,2017,abs/1706.03762,"Vaswani, A., Shazeer, N., Parmar, N., Uszkoreit, J., Jones, L., Gomez, A. N., Kaiser, L., and Polosukhin, I. Attention is all you need. CoRR, abs/1706.03762, 2017.",./refs/download/Fashion-gen: The generative fashion dataset and challenge.pdf,
0,"Veit, A., Kovacs, B., Bell, S., McAuley, J., Bala, K., Belongie, S.",Learning visual clothing style with heterogeneous dyadic co-occurrences,In Computer Vision (ICCV),. IEEE,,2015,"2015 IEEE International Conference on, pp. 4642–4650","Veit, A., Kovacs, B., Bell, S., McAuley, J., Bala, K., and Belongie, S. Learning visual clothing style with heterogeneous dyadic co-occurrences. In Computer Vision (ICCV), 2015 IEEE International Conference on, pp. 4642–4650. IEEE, 2015.",./refs/download/Fashion-gen: The generative fashion dataset and challenge.pdf,
0,"Xiao, T., Xia, T., Yang, Y., Huang, C., Wang, X.",Learning from massive noisy labeled data for image classification,In Proceedings of the IEEE Conference on Computer Vision and Pattern Recognition,,,2015,pp. 2691–2699,"Xiao, T., Xia, T., Yang, Y., Huang, C., and Wang, X. Learning from massive noisy labeled data for image classification. In Proceedings of the IEEE Conference on Computer Vision and Pattern Recognition, pp. 2691–2699, 2015.",./refs/download/Fashion-gen: The generative fashion dataset and challenge.pdf,
0,"Zhang, H., Xu, T., Li, H., Zhang, S., Huang, X., Wang, X., Metaxas, D.",Stackgan: Text to photo-realistic image synthesis with stacked generative adversarial networks,In IEEE Int. Conf. Comput. Vision (ICCV),,,2018,"pp. 5907–5915, 2017a. Zhang, H., Xu, T., Li, H., Zhang, S., Wang, X., Huang, X., and Metaxas, D. N. Stackgan++: Realistic image synthesis with stacked generative adversarial networks. CoRR, abs/1710.10916, 2017b. URL http://arxiv. org/abs/1710.10916. Zhang, Z., Xie, Y., and Yang, L. Photographic text-toimage synthesis with a hierarchically-nested adversarial network. arXiv preprint arXiv:1802.09178","Zhang, H., Xu, T., Li, H., Zhang, S., Huang, X., Wang, X., and Metaxas, D. Stackgan: Text to photo-realistic image synthesis with stacked generative adversarial networks. In IEEE Int. Conf. Comput. Vision (ICCV), pp. 5907–5915, 2017a. Zhang, H., Xu, T., Li, H., Zhang, S., Wang, X., Huang, X., and Metaxas, D. N. Stackgan++: Realistic image synthesis with stacked generative adversarial networks. CoRR, abs/1710.10916, 2017b. URL http://arxiv. org/abs/1710.10916. Zhang, Z., Xie, Y., and Yang, L. Photographic text-toimage synthesis with a hierarchically-nested adversarial network. arXiv preprint arXiv:1802.09178, 2018.",./refs/download/Fashion-gen: The generative fashion dataset and challenge.pdf,
0,,,,,,,,"Y. Cao, M. Long, B. Liu, and J. Wang. Deep cauchy hashing for hamming space retrieval. In Proceedings of the IEEE Conference on Computer Vision and Pattern Recognition, pages 1229",./refs/download/Central similarity quantization for efficient image and video retrieval.pdf,
0,,,,,,,,"Z. Cao, M. Long, J. Wang, and S. Y. Philip. Hashnet: Deep learning to hash by continuation. In ICCV, pages 5609",./refs/download/Central similarity quantization for efficient image and video retrieval.pdf,
0,,,,,,,,"Y.-W. Chao, S. Vijayanarasimhan, B. Seybold, D. A. Ross, J. Deng, and R. Sukthankar. Rethinking the faster r-cnn architecture for temporal action localization. In Proceedings of the IEEE Conference on Computer Vision and Pattern Recognition, pages 1130",./refs/download/Central similarity quantization for efficient image and video retrieval.pdf,
0,"Y. Chen, Y. Kalantidis, J. Li, S. Yan",and J. Feng. Multi-fiber networks for video recognition. arXiv preprint arXiv:1807.11195,,,,2018,,"Y. Chen, Y. Kalantidis, J. Li, S. Yan, and J. Feng. Multi-fiber networks for video recognition. arXiv preprint arXiv:1807.11195, 2018",./refs/download/Central similarity quantization for efficient image and video retrieval.pdf,
0,"T.-S. Chua, J. Tang, R. Hong, H. Li, Z. Luo, and Y. Zheng. Nus-wide: a real-world web image database from national university of singapore. In Proceedings of the ACM international conference on image and video retrieval",page 48. ACM,,,,2009,,"T.-S. Chua, J. Tang, R. Hong, H. Li, Z. Luo, and Y. Zheng. Nus-wide: a real-world web image database from national university of singapore. In Proceedings of the ACM international conference on image and video retrieval, page 48. ACM, 2009",./refs/download/Central similarity quantization for efficient image and video retrieval.pdf,
0,,,,,,,,"J. Donahue, L. Anne Hendricks, S. Guadarrama, M. Rohrbach, S. Venugopalan, K. Saenko, and T. Darrell. Long-term recurrent convolutional networks for visual recognition and description. In Proceedings of the IEEE conference on computer vision and pattern recognition, pages 2625",./refs/download/Central similarity quantization for efficient image and video retrieval.pdf,
0,,,,,,,,"Y. Gong, S. Lazebnik, A. Gordo, and F. Perronnin. Iterative quantization: A procrustean approach to learning binary codes for large-scale image retrieval. IEEE Transactions on Pattern Analysis and Machine Intelligence, 35(12):2916– 2929",./refs/download/Central similarity quantization for efficient image and video retrieval.pdf,
0,,,,,,,,"Y. Gu, C. Ma, and J. Yang. Supervised recurrent hashing for large scale video retrieval. In Proceedings of the 2016",./refs/download/Central similarity quantization for efficient image and video retrieval.pdf,
0,"K. He, X. Zhang, S. Ren, and J. Sun. Deep residual learning for image recognition. In Proceedings of the IEEE conference on computer vision and pattern recognition",pages 770–778,,,,2016,,"K. He, X. Zhang, S. Ren, and J. Sun. Deep residual learning for image recognition. In Proceedings of the IEEE conference on computer vision and pattern recognition, pages 770–778, 2016",./refs/download/Central similarity quantization for efficient image and video retrieval.pdf,
0,,,,,,,,"L. Karlinsky, J. Shtok, S. Harary, E. Schwartz, A. Aides, R. Feris, R. Giryes, and A. M. Bronstein. Repmet: Representative-based metric learning for classification and few-shot object detection. In Proceedings of the IEEE Conference on Computer Vision and Pattern Recognition, pages 5197",./refs/download/Central similarity quantization for efficient image and video retrieval.pdf,
0,"H. Kuehne, H. Jhuang, R. Stiefelhagen, and T. Serre. Hmdb51: A large video database for human motion recognition. In High Performance Computing in Science and Engineering 12",pages 571–582. Springer,,,,2013,,"H. Kuehne, H. Jhuang, R. Stiefelhagen, and T. Serre. Hmdb51: A large video database for human motion recognition. In High Performance Computing in Science and Engineering 12, pages 571–582. Springer, 2013",./refs/download/Central similarity quantization for efficient image and video retrieval.pdf,
0,,,,,,,,"B. Kulis and T. Darrell. Learning to hash with binary reconstructive embeddings. In Advances in neural information processing systems, pages 1042",./refs/download/Central similarity quantization for efficient image and video retrieval.pdf,
0,,,,,,,," ceedings of the IEEE conference on computer vision and pattern recognition, pages 3270",./refs/download/Central similarity quantization for efficient image and video retrieval.pdf,
0,"F. Shen, C. Shen, W. Liu, and H. Tao Shen. Supervised discrete hashing. In Proceedings of the IEEE conference on computer vision and pattern recognition",pages 37–45,,,,2015,,"F. Shen, C. Shen, W. Liu, and H. Tao Shen. Supervised discrete hashing. In Proceedings of the IEEE conference on computer vision and pattern recognition, pages 37–45, 2015",./refs/download/Central similarity quantization for efficient image and video retrieval.pdf,
0,K. Simonyan and A. Zisserman. Two-stream convolutional networks for action recognition in videos. In Advances in neural information processing systems,pages 568–576,,,,2014,,"K. Simonyan and A. Zisserman. Two-stream convolutional networks for action recognition in videos. In Advances in neural information processing systems, pages 568–576, 2014",./refs/download/Central similarity quantization for efficient image and video retrieval.pdf,
0,,,,,,,,"D. Song, W. Liu, R. Ji, D. A. Meyer, and J. R. Smith. Top rank supervised binary coding for visual search. In Proceedings of the IEEE International Conference on Computer Vision, pages 1922",./refs/download/Central similarity quantization for efficient image and video retrieval.pdf,
0,"K. Soomro, A. R. Zamir",and M. Shah. Ucf101: A dataset of 101 human actions classes from videos in the wild. arXiv preprint arXiv:1212.0402,,,,2012,,"K. Soomro, A. R. Zamir, and M. Shah. Ucf101: A dataset of 101 human actions classes from videos in the wild. arXiv preprint arXiv:1212.0402, 2012",./refs/download/Central similarity quantization for efficient image and video retrieval.pdf,
0,"G. Varol, I. Laptev, and C. Schmid. Long-term temporal convolutions for action recognition. IEEE transactions on pattern analysis and machine intelligence",40(6):1510–1517,,,,2017,,"G. Varol, I. Laptev, and C. Schmid. Long-term temporal convolutions for action recognition. IEEE transactions on pattern analysis and machine intelligence, 40(6):1510–1517, 2017",./refs/download/Central similarity quantization for efficient image and video retrieval.pdf,
0,"J. Wang, W. Liu, S. Kumar, and S.-F. Chang. Learning to hash for indexing big dataa survey. Proceedings of the IEEE",104(1):34–57,,,,2016,,"J. Wang, W. Liu, S. Kumar, and S.-F. Chang. Learning to hash for indexing big dataa survey. Proceedings of the IEEE, 104(1):34–57, 2016",./refs/download/Central similarity quantization for efficient image and video retrieval.pdf,
0,,,,,,,,"J. Wang, W. Liu, A. X. Sun, and Y.-G. Jiang. Learning hash codes with listwise supervision. In Proceedings of the IEEE International Conference on Computer Vision, pages 3032",./refs/download/Central similarity quantization for efficient image and video retrieval.pdf,
0,"L. Wang, Y. Xiong, Z. Wang, Y. Qiao, D. Lin, X. Tang, and L. Van Gool. Temporal segment networks: Towards good practices for deep action recognition. In European conference on computer vision",pages 20–36. Springer,,,,2016,,"L. Wang, Y. Xiong, Z. Wang, Y. Qiao, D. Lin, X. Tang, and L. Van Gool. Temporal segment networks: Towards good practices for deep action recognition. In European conference on computer vision, pages 20–36. Springer, 2016",./refs/download/Central similarity quantization for efficient image and video retrieval.pdf,
0,"T. Weise, M. Zapf, R. Chiong, and A. J. Nebro. Why is optimization difficult? In Nature-Inspired Algorithms for Optimisation",pages 1–50. Springer,,,,2009,,"T. Weise, M. Zapf, R. Chiong, and A. J. Nebro. Why is optimization difficult? In Nature-Inspired Algorithms for Optimisation, pages 1–50. Springer, 2009",./refs/download/Central similarity quantization for efficient image and video retrieval.pdf,
0,,,,,,,,"Y. Weiss, A. Torralba, and R. Fergus. Spectral hashing. In Advances in neural information processing systems, pages 1753",./refs/download/Central similarity quantization for efficient image and video retrieval.pdf,
0,,,,,,,,E. W. Weisstein. Hadamard matrix. 2002,./refs/download/Central similarity quantization for efficient image and video retrieval.pdf,
