,authors,title,journal,publisher,volume,year,pages,full_ref,source_file,source_title
0,"Y. Wen, K. Zhang, Z. Li, and Y. Qiao. A discriminative feature learning approach for deep face recognition. In European Conference on Computer Vision",pages 499–515. Springer,,,,2016,,"Y. Wen, K. Zhang, Z. Li, and Y. Qiao. A discriminative feature learning approach for deep face recognition. In European Conference on Computer Vision, pages 499–515. Springer, 2016",./refs/download/Central similarity quantization for efficient image and video retrieval.pdf,
0,"R. Xia, Y. Pan, H. Lai, C. Liu, and S. Yan. Supervised hashing for image retrieval via image representation learning. In AAAI",volume 1,page 2,,,2014,,"R. Xia, Y. Pan, H. Lai, C. Liu, and S. Yan. Supervised hashing for image retrieval via image representation learning. In AAAI, volume 1, page 2, 2014",./refs/download/Central similarity quantization for efficient image and video retrieval.pdf,
0,,,,,,,,"E. Yang, T. Liu, C. Deng, W. Liu, and D. Tao. Distillhash: Unsupervised deep hashing by distilling data pairs. In Proceedings of the IEEE Conference on Computer Vision and Pattern Recognition, pages 2946",./refs/download/Central similarity quantization for efficient image and video retrieval.pdf,
0,"L. Yuan, E. H. F. Tay",P. Li,and J. Feng. Unsupervised video summarization with cycle-consistent adversarial lstm networks. IEEE Transactions on Multimedia,,,2019,,"L. Yuan, E. H. F. Tay, P. Li, and J. Feng. Unsupervised video summarization with cycle-consistent adversarial lstm networks. IEEE Transactions on Multimedia, 2019",./refs/download/Central similarity quantization for efficient image and video retrieval.pdf,
0,,,,,,,,"L. Yuan, F. E. Tay, P. Li, L. Zhou, and J. Feng. Cycle-sum: cycle-consistent adversarial lstm networks for unsupervised video summarization. In Proceedings of the AAAI Conference on Artificial Intelligence, volume 33, pages 9143",./refs/download/Central similarity quantization for efficient image and video retrieval.pdf,
0,,,,,,,,"H. Zhu, M. Long, J. Wang, and Y. Cao. Deep hashing network for efficient similarity retrieval. In AAAI, pages 2415",./refs/download/Central similarity quantization for efficient image and video retrieval.pdf,
0,"N. Zhuang, J. Ye",and K. A. Hua. Dlstm approach to video modeling with hashing for large-scale video retrieval. In Pattern Recognition (ICPR),,,,2016,,"N. Zhuang, J. Ye, and K. A. Hua. Dlstm approach to video modeling with hashing for large-scale video retrieval. In Pattern Recognition (ICPR), 2016",./refs/download/Central similarity quantization for efficient image and video retrieval.pdf,
0,,,,,,,,"proposed multi-component labeling benchmark containing  • We introduce PartNet, consisting of 573,585 finegrained part annotations for 26,671 shapes across 24 object categories. To the best of our knowledge, it is the first large-scale dataset with fine-grained, hierarchical, instance-level part annotations; • We propose three part-level object understanding tasks to demonstrate the usefulness of this data: fine-grained semantic segmentation, hierarchical semantic segmentation, and instance segmentation. 2  Bag  Keyboard  Bed  Bowl  Knife  Laptop  Clock  Lamp  Dishwasher  Microwave  Display  Mug  Door  Refrigerator  Earphone  Chair  Scissors  Faucet  Table  Hat  Trash Can  Storage Furniture  Vase  Bottle  Figure 2. PartNet dataset. We visualize example shapes with fine-grained part annotations for the 24 object categories in PartNet. #A #S #M #PS #PI Pmed Pmax Dmed Dmax  All Bag 3253",./refs/download/Partnet: A large-scale benchmark for finegrained and hierarchical part-level 3d object understanding.pdf,
0,"R. Hu, W. Li, O. Van Kaick, A. Shamir, H. Zhang, and H. Huang. Learning to predict part mobility from a single static snapshot. ACM Transactions on Graphics (TOG)",36(6):227,,,,2017,,"R. Hu, W. Li, O. Van Kaick, A. Shamir, H. Zhang, and H. Huang. Learning to predict part mobility from a single static snapshot. ACM Transactions on Graphics (TOG), 36(6):227, 2017",./refs/download/Partnet: A large-scale benchmark for finegrained and hierarchical part-level 3d object understanding.pdf,
0,"R. Hu, O. van Kaick, B. Wu, H. Huang, A. Shamir, and H. Zhang. Learning how objects function via co-analysis of interactions. ACM Transactions on Graphics (TOG)",35(4):47,,,,2016,,"R. Hu, O. van Kaick, B. Wu, H. Huang, A. Shamir, and H. Zhang. Learning how objects function via co-analysis of interactions. ACM Transactions on Graphics (TOG), 35(4):47, 2016",./refs/download/Partnet: A large-scale benchmark for finegrained and hierarchical part-level 3d object understanding.pdf,
0,"R. Hu, Z. Yan, J. Zhang, O. van Kaick, A. Shamir, H. Zhang, and H. Huang. Predictive and generative neural networks for object functionality. In Computer Graphics Forum (Eurographics State-of-the-art report)",volume 37,pages 603– 624,,,2018,,"R. Hu, Z. Yan, J. Zhang, O. van Kaick, A. Shamir, H. Zhang, and H. Huang. Predictive and generative neural networks for object functionality. In Computer Graphics Forum (Eurographics State-of-the-art report), volume 37, pages 603– 624, 2018",./refs/download/Partnet: A large-scale benchmark for finegrained and hierarchical part-level 3d object understanding.pdf,
0,"J. Huang, H. Su",and L. Guibas. Robust watertight manifold surface generation method for shapenet models. arXiv preprint arXiv:1802.01698,,,,2018,,"J. Huang, H. Su, and L. Guibas. Robust watertight manifold surface generation method for shapenet models. arXiv preprint arXiv:1802.01698, 2018",./refs/download/Partnet: A large-scale benchmark for finegrained and hierarchical part-level 3d object understanding.pdf,
0,"T. Ritschel, and H.-P. Seidel. Exploring shape variations by 3d-model decomposition and partbased recombination. In Computer Graphics Forum",volume 31,pages 631–640. Wiley Online Library,,,2012,,"A. Jain, T. Thormählen, T. Ritschel, and H.-P. Seidel. Exploring shape variations by 3d-model decomposition and partbased recombination. In Computer Graphics Forum, volume 31, pages 631–640. Wiley Online Library, 2012",./refs/download/Partnet: A large-scale benchmark for finegrained and hierarchical part-level 3d object understanding.pdf,
0,"E. Kalogerakis, A. Hertzmann, and K. Singh. Learning 3D mesh segmentation and labeling. ACM Transactions on Graphics (TOG)",29(4):102,,,,2010,,"E. Kalogerakis, A. Hertzmann, and K. Singh. Learning 3D mesh segmentation and labeling. ACM Transactions on Graphics (TOG), 29(4):102, 2010",./refs/download/Partnet: A large-scale benchmark for finegrained and hierarchical part-level 3d object understanding.pdf,
0,"G. Kim, S. Chaudhuri, L. Guibas, and T. Funkhouser. Shape2pose: Human-centric shape analysis. ACM Transactions on Graphics (TOG)",33(4):120,,,,2014,,"V. G. Kim, S. Chaudhuri, L. Guibas, and T. Funkhouser. Shape2pose: Human-centric shape analysis. ACM Transactions on Graphics (TOG), 33(4):120, 2014",./refs/download/Partnet: A large-scale benchmark for finegrained and hierarchical part-level 3d object understanding.pdf,
0,,,,,,,,"R. Klokov and V. Lempitsky. Escape from cells: Deep kdnetworks for the recognition of 3D point cloud models. In Computer Vision (ICCV), 2017",./refs/download/Partnet: A large-scale benchmark for finegrained and hierarchical part-level 3d object understanding.pdf,
0,"E. Kolve, R. Mottaghi, D. Gordon, Y. Zhu, A. Gupta",and A. Farhadi. Ai2-thor: An interactive 3d environment for visual ai. arXiv preprint arXiv:1712.05474,,,,2017,,"E. Kolve, R. Mottaghi, D. Gordon, Y. Zhu, A. Gupta, and A. Farhadi. Ai2-thor: An interactive 3d environment for visual ai. arXiv preprint arXiv:1712.05474, 2017",./refs/download/Partnet: A large-scale benchmark for finegrained and hierarchical part-level 3d object understanding.pdf,
0,P. Krähenbühl and V. Koltun. Parameter learning and convergent inference for dense random fields. In International Conference on Machine Learning,pages 513–521,,,,2013,,"P. Krähenbühl and V. Koltun. Parameter learning and convergent inference for dense random fields. In International Conference on Machine Learning, pages 513–521, 2013",./refs/download/Partnet: A large-scale benchmark for finegrained and hierarchical part-level 3d object understanding.pdf,
0,H. W. Kuhn. The hungarian method for the assignment problem. Naval research logistics quarterly,2(1-2):83–97,,,,1955,,"H. W. Kuhn. The hungarian method for the assignment problem. Naval research logistics quarterly, 2(1-2):83–97, 1955",./refs/download/Partnet: A large-scale benchmark for finegrained and hierarchical part-level 3d object understanding.pdf,
0,,,,,,,,"T. Le and Y. Duan. PointGrid: A deep network for 3D shape understanding. In Proceedings of the IEEE Conference on Computer Vision and Pattern Recognition, pages 9204",./refs/download/Partnet: A large-scale benchmark for finegrained and hierarchical part-level 3d object understanding.pdf,
0,,,,,,,,"J. Li, B. M. Chen, and G. H. Lee. SO-Net: Self-organizing network for point cloud analysis. In Proceedings of the IEEE Conference on Computer Vision and Pattern Recognition, pages 9397",./refs/download/Partnet: A large-scale benchmark for finegrained and hierarchical part-level 3d object understanding.pdf,
0,"J. Li, K. Xu, S. Chaudhuri, E. Yumer, H. Zhang, and L. Guibas. Grass: Generative recursive autoencoders for shape structures. ACM Transactions on Graphics (TOG)",36(4):52,,,,2017,,"J. Li, K. Xu, S. Chaudhuri, E. Yumer, H. Zhang, and L. Guibas. Grass: Generative recursive autoencoders for shape structures. ACM Transactions on Graphics (TOG), 36(4):52, 2017",./refs/download/Partnet: A large-scale benchmark for finegrained and hierarchical part-level 3d object understanding.pdf,
0,"Y. Li, R. Bu, M. Sun",and B. Chen. PointCNN: Convolution on X -transformed points. Advances in neural information processing systems (NIPS),,,,2018,,"Y. Li, R. Bu, M. Sun, and B. Chen. PointCNN: Convolution on X -transformed points. Advances in neural information processing systems (NIPS), 2018",./refs/download/Partnet: A large-scale benchmark for finegrained and hierarchical part-level 3d object understanding.pdf,
0,"Z. Liu, W. T. Freeman",J. B. Tenenbaum,and J. Wu. Physical primitive decomposition. arXiv preprint arXiv:1809.05070,,,2018,,"Z. Liu, W. T. Freeman, J. B. Tenenbaum, and J. Wu. Physical primitive decomposition. arXiv preprint arXiv:1809.05070, 2018",./refs/download/Partnet: A large-scale benchmark for finegrained and hierarchical part-level 3d object understanding.pdf,
0,"M. Attene, S. Katz, M. Mortara, G. Patané",M. Spagnuolo,and A. Tal. Mesh segmentation-a comparative study. In Shape Modeling and Applications,,,2006,,"M. Attene, S. Katz, M. Mortara, G. Patané, M. Spagnuolo, and A. Tal. Mesh segmentation-a comparative study. In Shape Modeling and Applications, 2006",./refs/download/Partnet: A large-scale benchmark for finegrained and hierarchical part-level 3d object understanding.pdf,
0,"H. Benhabiles, J.-P. Vandeborre, G. Lavoué",and M. Daoudi. A framework for the objective evaluation of segmentation algorithms using a ground-truth of human segmented 3Dmodels. In IEEE International Conference on Shape Modeling and Applications (SMI),pages Session–5,,,2009,,"H. Benhabiles, J.-P. Vandeborre, G. Lavoué, and M. Daoudi. A framework for the objective evaluation of segmentation algorithms using a ground-truth of human segmented 3Dmodels. In IEEE International Conference on Shape Modeling and Applications (SMI), pages Session–5, 2009",./refs/download/Partnet: A large-scale benchmark for finegrained and hierarchical part-level 3d object understanding.pdf,
0,"X. Chang, T. Funkhouser, L. Guibas, P. Hanrahan, Q. Huang, Z. Li, S. Savarese, M. Savva, S. Song, H. Su",et al. ShapeNet: An information-rich 3D model repository. arXiv preprint arXiv:1512.03012,,,,2015,,"A. X. Chang, T. Funkhouser, L. Guibas, P. Hanrahan, Q. Huang, Z. Li, S. Savarese, M. Savva, S. Song, H. Su, et al. ShapeNet: An information-rich 3D model repository. arXiv preprint arXiv:1512.03012, 2015",./refs/download/Partnet: A large-scale benchmark for finegrained and hierarchical part-level 3d object understanding.pdf,
0,"X. Chang, R. Mago, P. Krishna, M. Savva",and C. Fellbaum. Linking WordNet to 3D shapes. In Global WordNet Conference,,,,2018,,"A. X. Chang, R. Mago, P. Krishna, M. Savva, and C. Fellbaum. Linking WordNet to 3D shapes. In Global WordNet Conference, 2018",./refs/download/Partnet: A large-scale benchmark for finegrained and hierarchical part-level 3d object understanding.pdf,
0,"X. Chen, A. Golovinskiy",and T. Funkhouser. A benchmark for 3D mesh segmentation. ACM Transactions on Graphics (Proc. SIGGRAPH),,,,2009,,"X. Chen, A. Golovinskiy, and T. Funkhouser. A benchmark for 3D mesh segmentation. ACM Transactions on Graphics (Proc. SIGGRAPH), 2009",./refs/download/Partnet: A large-scale benchmark for finegrained and hierarchical part-level 3d object understanding.pdf,
0,"B. Graham, M. Engelcke, and L. van der Maaten. 3D semantic segmentation with submanifold sparse convolutional networks. Proceedings of the IEEE Computer Vision and Pattern Recognition (CVPR)",pages 18–22,,,,2018,,"B. Graham, M. Engelcke, and L. van der Maaten. 3D semantic segmentation with submanifold sparse convolutional networks. Proceedings of the IEEE Computer Vision and Pattern Recognition (CVPR), pages 18–22, 2018",./refs/download/Partnet: A large-scale benchmark for finegrained and hierarchical part-level 3d object understanding.pdf,
0,"P. Hermosilla, T. Ritschel, P.-P. Vázquez",À. Vinacua,and T. Ropinski. Monte carlo convolution for learning on non-uniformly sampled point clouds. arXiv preprint arXiv:1806.01759,,,2018,,"P. Hermosilla, T. Ritschel, P.-P. Vázquez, À. Vinacua, and T. Ropinski. Monte carlo convolution for learning on non-uniformly sampled point clouds. arXiv preprint arXiv:1806.01759, 2018",./refs/download/Partnet: A large-scale benchmark for finegrained and hierarchical part-level 3d object understanding.pdf,
0,D. D. Hoffman and W. A. Richards. Parts of recognition. Cognition,18(1-3):65–96,,,,1984,,"D. D. Hoffman and W. A. Richards. Parts of recognition. Cognition, 18(1-3):65–96, 1984",./refs/download/Partnet: A large-scale benchmark for finegrained and hierarchical part-level 3d object understanding.pdf,
0,,,,,,,,"R. Hu, L. Fan, and L. Liu. Co-segmentation of 3D shapes via subspace clustering. In Computer graphics forum, volume 31, pages 1703",./refs/download/Partnet: A large-scale benchmark for finegrained and hierarchical part-level 3d object understanding.pdf,
0,"C. Yan, D. Misra, A. Bennnett, A. Walsman, Y. Bisk",and Y. Artzi. Chalet: Cornell house agent learning environment. arXiv preprint arXiv:1801.07357,,,,2018,,"C. Yan, D. Misra, A. Bennnett, A. Walsman, Y. Bisk, and Y. Artzi. Chalet: Cornell house agent learning environment. arXiv preprint arXiv:1801.07357, 2018",./refs/download/Partnet: A large-scale benchmark for finegrained and hierarchical part-level 3d object understanding.pdf,
0,"L. Yi, L. Guibas, A. Hertzmann, V. G. Kim",H. Su,and E. Yumer. Learning hierarchical shape segmentation and labeling from online repositories. ACM Transactions on Graphics (Proc. SIGGRAPH Asia),,,2017,,"L. Yi, L. Guibas, A. Hertzmann, V. G. Kim, H. Su, and E. Yumer. Learning hierarchical shape segmentation and labeling from online repositories. ACM Transactions on Graphics (Proc. SIGGRAPH Asia), 2017",./refs/download/Partnet: A large-scale benchmark for finegrained and hierarchical part-level 3d object understanding.pdf,
0,"G. Kim, D. Ceylan, I. Shen, M. Yan, H. Su, C. Lu, Q. Huang, A. Sheffer, L. Guibas, et al. A scalable active framework for region annotation in 3D shape collections. ACM Transactions on Graphics (TOG)",35(6):210,,,,2016,,"L. Yi, V. G. Kim, D. Ceylan, I. Shen, M. Yan, H. Su, C. Lu, Q. Huang, A. Sheffer, L. Guibas, et al. A scalable active framework for region annotation in 3D shape collections. ACM Transactions on Graphics (TOG), 35(6):210, 2016",./refs/download/Partnet: A large-scale benchmark for finegrained and hierarchical part-level 3d object understanding.pdf,
0,,,,,,,,"L. Yi, H. Su, X. Guo, and L. J. Guibas. SyncSpecCNN: Synchronized spectral CNN for 3D shape segmentation. Proceedings of the IEEE Conference on Computer Vision and Pattern Recognition (CVPR), pages 6584",./refs/download/Partnet: A large-scale benchmark for finegrained and hierarchical part-level 3d object understanding.pdf,
0,"Y. Zhu, D. Gordon, E. Kolve, D. Fox, L. Fei-Fei, A. Gupta, R. Mottaghi, and A. Farhadi. Visual semantic planning using deep successor representations. arXiv preprint ArXiv:1705.08080",pages 1–13,,,,2017,,"Y. Zhu, D. Gordon, E. Kolve, D. Fox, L. Fei-Fei, A. Gupta, R. Mottaghi, and A. Farhadi. Visual semantic planning using deep successor representations. arXiv preprint ArXiv:1705.08080, pages 1–13, 2017",./refs/download/Partnet: A large-scale benchmark for finegrained and hierarchical part-level 3d object understanding.pdf,
0,L. v. d. Maaten and G. Hinton. Visualizing data using t-sne. Journal of machine learning research,9(Nov):2579–2605,,,,2008,,"L. v. d. Maaten and G. Hinton. Visualizing data using t-sne. Journal of machine learning research, 9(Nov):2579–2605, 2008",./refs/download/Partnet: A large-scale benchmark for finegrained and hierarchical part-level 3d object understanding.pdf,
0,"M. Ovsjanikov, W. Li, L. Guibas, and N. J. Mitra. Exploration of continuous variability in collections of 3d shapes. In ACM Transactions on Graphics (TOG)",volume 30,page 33. ACM,,,2011,,"M. Ovsjanikov, W. Li, L. Guibas, and N. J. Mitra. Exploration of continuous variability in collections of 3d shapes. In ACM Transactions on Graphics (TOG), volume 30, page 33. ACM, 2011",./refs/download/Partnet: A large-scale benchmark for finegrained and hierarchical part-level 3d object understanding.pdf,
0,"X. Puig, K. Ra, M. Boben, J. Li, T. Wang, S. Fidler",and A. Torralba. Virtualhome: Simulating household activities via programs. In CVPR,,,,2018,,"X. Puig, K. Ra, M. Boben, J. Li, T. Wang, S. Fidler, and A. Torralba. Virtualhome: Simulating household activities via programs. In CVPR, 2018",./refs/download/Partnet: A large-scale benchmark for finegrained and hierarchical part-level 3d object understanding.pdf,
0,IEEE,volume 1,page 4,,,2017,,"C. R. Qi, H. Su, K. Mo, and L. J. Guibas. PointNet: Deep learning on point sets for 3D classification and segmentation. In Proc. Computer Vision and Pattern Recognition (CVPR), IEEE, volume 1, page 4, 2017",./refs/download/Partnet: A large-scale benchmark for finegrained and hierarchical part-level 3d object understanding.pdf,
0,,,,,,,,"C. R. Qi, L. Yi, H. Su, and L. J. Guibas. PointNet++: Deep hierarchical feature learning on point sets in a metric space. In Advances in Neural Information Processing Systems, pages 5099",./refs/download/Partnet: A large-scale benchmark for finegrained and hierarchical part-level 3d object understanding.pdf,
0,,,,,,,,"H. Su, V. Jampani, D. Sun, S. Maji, E. Kalogerakis, M.-H. Yang, and J. Kautz. SplatNet: Sparse lattice networks for point cloud processing. In Proceedings of the IEEE Conference on Computer Vision and Pattern Recognition, pages 2530",./refs/download/Partnet: A large-scale benchmark for finegrained and hierarchical part-level 3d object understanding.pdf,
0,"M. Sung, H. Su, R. Yu",and L. Guibas. Deep functional dictionaries: Learning consistent semantic structures on 3D models from functions. Advances in neural information processing systems (NIPS),,,,2018,,"M. Sung, H. Su, R. Yu, and L. Guibas. Deep functional dictionaries: Learning consistent semantic structures on 3D models from functions. Advances in neural information processing systems (NIPS), 2018",./refs/download/Partnet: A large-scale benchmark for finegrained and hierarchical part-level 3d object understanding.pdf,
0,"P.-S. Wang, Y. Liu, Y.-X. Guo, C.-Y. Sun, and X. Tong. OCNN: Octree-based convolutional neural networks for 3D shape analysis. ACM Transactions on Graphics (TOG)",36(4):72,,,,2017,,"P.-S. Wang, Y. Liu, Y.-X. Guo, C.-Y. Sun, and X. Tong. OCNN: Octree-based convolutional neural networks for 3D shape analysis. ACM Transactions on Graphics (TOG), 36(4):72, 2017",./refs/download/Partnet: A large-scale benchmark for finegrained and hierarchical part-level 3d object understanding.pdf,
0,,,,,,,,"W. Wang, R. Yu, Q. Huang, and U. Neumann. SGPN: Similarity group proposal network for 3D point cloud instance segmentation. In Proceedings of the IEEE Conference on Computer Vision and Pattern Recognition (CVPR), pages 2569",./refs/download/Partnet: A large-scale benchmark for finegrained and hierarchical part-level 3d object understanding.pdf,
0,,,,,,,,"X. Wang, B. Zhou, H. Fang, X. Chen, Q. Zhao, and K. Xu. Learning to group and label fine-grained shape components. ACM Transactions on Graphics (SIGGRAPH Asia 2018)",./refs/download/Partnet: A large-scale benchmark for finegrained and hierarchical part-level 3d object understanding.pdf,
0,"Y. Wang, S. Asafi, O. Van Kaick, H. Zhang, D. Cohen-Or, and B. Chen. Active co-analysis of a set of shapes. ACM Transactions on Graphics (TOG)",31(6):165,,,,2012,,"Y. Wang, S. Asafi, O. Van Kaick, H. Zhang, D. Cohen-Or, and B. Chen. Active co-analysis of a set of shapes. ACM Transactions on Graphics (TOG), 31(6):165, 2012",./refs/download/Partnet: A large-scale benchmark for finegrained and hierarchical part-level 3d object understanding.pdf,
0,"Y. Wang, Y. Sun, Z. Liu, S. E. Sarma",M. M. Bronstein,and J. M. Solomon. Dynamic graph cnn for learning on point clouds. arXiv preprint arXiv:1801.07829,,,2018,,"Y. Wang, Y. Sun, Z. Liu, S. E. Sarma, M. M. Bronstein, and J. M. Solomon. Dynamic graph cnn for learning on point clouds. arXiv preprint arXiv:1801.07829, 2018",./refs/download/Partnet: A large-scale benchmark for finegrained and hierarchical part-level 3d object understanding.pdf,
0,,,,,,,,"Z. Wang and F. Lu. VoxSegNet: Volumetric CNNs for semantic part segmentation of 3D shapes. arXiv preprint arXiv:1809.00226, 2018",./refs/download/Partnet: A large-scale benchmark for finegrained and hierarchical part-level 3d object understanding.pdf,
0,"Z. Wu, X. Wang, D. Lin, D. Lischinski, D. Cohen-Or",and H. Huang. Structure-aware generative network for 3d-shape modeling. arXiv preprint arXiv:1808.03981,,,,2018,,"Z. Wu, X. Wang, D. Lin, D. Lischinski, D. Cohen-Or, and H. Huang. Structure-aware generative network for 3d-shape modeling. arXiv preprint arXiv:1808.03981, 2018",./refs/download/Partnet: A large-scale benchmark for finegrained and hierarchical part-level 3d object understanding.pdf,
0,"Y. Xu, T. Fan, M. Xu, L. Zeng",and Y. Qiao. SpiderCNN: Deep learning on point sets with parameterized convolutional filters. European Conference on Computer Vision (ECCV),,,,2018,,"Y. Xu, T. Fan, M. Xu, L. Zeng, and Y. Qiao. SpiderCNN: Deep learning on point sets with parameterized convolutional filters. European Conference on Computer Vision (ECCV), 2018",./refs/download/Partnet: A large-scale benchmark for finegrained and hierarchical part-level 3d object understanding.pdf,
0,"Lee, S., Alexander, M. L., Jacobs, D. W., Belhumeur, P. N.",Birdsnap: Large-scale fine-grained visual categorization of birds,CVPR,,,2014,pp. 2011–2018,"Lee, S., Alexander, M. L., Jacobs, D. W., and Belhumeur, P. N. Birdsnap: Large-scale fine-grained visual categorization of birds. CVPR, pp. 2011–2018, 2014.",./refs/download/Efficientnet: Rethinking model scaling for convolutional neural networks.pdf,
0,"Bossard, L., Guillaumin, M.",", and Van Gool, L",Food-101– mining discriminative components with random forests. ECCV,,,2014,pp. 446–461,"Bossard, L., Guillaumin, M., and Van Gool, L. Food-101– mining discriminative components with random forests. ECCV, pp. 446–461, 2014.",./refs/download/Efficientnet: Rethinking model scaling for convolutional neural networks.pdf,
0,"Cai, H., Zhu, L., Han, S.",Proxylessnas: Direct neural architecture search on target task and hardware,ICLR,,,2019,,"Cai, H., Zhu, L., and Han, S. Proxylessnas: Direct neural architecture search on target task and hardware. ICLR, 2019.",./refs/download/Efficientnet: Rethinking model scaling for convolutional neural networks.pdf,
0,"Cubuk, E. D., Zoph, B., Mane, D., Vasudevan, V., Le, Q. V.",Autoaugment: Learning augmentation policies from data,CVPR,,,2019,,"Cubuk, E. D., Zoph, B., Mane, D., Vasudevan, V., and Le, Q. V. Autoaugment: Learning augmentation policies from data. CVPR, 2019.",./refs/download/Efficientnet: Rethinking model scaling for convolutional neural networks.pdf,
0,"Elfwing, S., Uchibe, E., Doya, K.",Sigmoid-weighted linear units for neural network function approximation in reinforcement learning,Neural Networks,,,2018,107:3–11,"Elfwing, S., Uchibe, E., and Doya, K. Sigmoid-weighted linear units for neural network function approximation in reinforcement learning. Neural Networks, 107:3–11, 2018.",./refs/download/Efficientnet: Rethinking model scaling for convolutional neural networks.pdf,
0,"Gholami, A., Kwon, K., Wu, B., Tai, Z., Yue, X., Jin, P., Zhao, S., Keutzer, K.",Squeezenext: Hardware-aware neural network design,ECV Workshop at CVPR’18,,,2018,,"Gholami, A., Kwon, K., Wu, B., Tai, Z., Yue, X., Jin, P., Zhao, S., and Keutzer, K. Squeezenext: Hardware-aware neural network design. ECV Workshop at CVPR’18, 2018.",./refs/download/Efficientnet: Rethinking model scaling for convolutional neural networks.pdf,
0,"Han, S., Mao, H., Dally, W. J.","Deep compression: Compressing deep neural networks with pruning, trained quantization and huffman coding",ICLR,,,2016,,"Han, S., Mao, H., and Dally, W. J. Deep compression: Compressing deep neural networks with pruning, trained quantization and huffman coding. ICLR, 2016.",./refs/download/Efficientnet: Rethinking model scaling for convolutional neural networks.pdf,
